tweet_id,author_id,text,tweet_type,like_count,company_name,quote_count,reply_count,retweet_count,created_at
tweet_id,author_id,text,tweet_type,like_count,company_name,quote_count,reply_count,retweet_count,created_at
1584552575600586755,2293315159,"Happy #Diwali to all those celebrating! May your festivities be filled with joy and light.
 
In this 2010 photo, President @BarackObama and First Lady @MichelleObama are at a Diwali candle lighting and performance at Holy Name High School in Mumbai, India. https://t.co/bT330Go17H",,937,ObamaFoundation,7,23,171,2022-10-24T14:29:08.000Z
1583760070067646464,2293315159,"Through our #ObamaLeaders Programs in Africa, Asia-Pacific, and Europe, we're supporting the next generation of leaders who aren’t waiting for someone else to tackle the world's biggest problems. Is that you?

Apply before Monday's 12 PM EST deadline! https://t.co/3ExyQ6m8c8 https://t.co/KNabtYVtWc",,333,ObamaFoundation,13,37,102,2022-10-22T10:00:00.000Z
1583560729487372288,2293315159,"“I had to learn how to love my story and to tell it with pride. I grew up on the South Side of Chicago and I'm proud of that.”
 
This week, former First Lady @MichelleObama returned to her hometown to host our latest Futures Series at Hyde Park Academy. Take a look: https://t.co/Mg3JRRlRP6",,878,ObamaFoundation,16,56,196,2022-10-21T20:47:53.000Z
1583486628428849152,2293315159,Addison Belhomme is a 15-year-old student filmmaker from Chicago who is part of @PolishedPebbles. We invited her to tell her story as part of our new #GetHerThere campaign. Take a look! 💙 https://t.co/3Lo18gAE9w,retweeted,0,ObamaFoundation,0,0,25,2022-10-21T15:53:26.000Z
1583171157401882625,2293315159,"Rowinda, one of our inspiring #ObamaLeaders from Amsterdam, shares why she thinks YOU should apply to join our 2023 Leaders Europe cohort.
 
🚨 Applications close this Monday at 12 PM EST! Learn more at: https://t.co/3ExyQ6m8c8 https://t.co/l4iIEr1P4g",,84,ObamaFoundation,1,6,30,2022-10-20T18:59:52.000Z
1582731629508038656,2293315159,"We had a special—and highly requested—guest at Monday's Futures Series. 👀 

Students at Hyde Park Academy had the opportunity to spend time with South Side native @MichelleObama. Stay tuned for the highlights! https://t.co/xCAnBGcEb0",,288,ObamaFoundation,5,26,66,2022-10-19T13:53:20.000Z
1582729627507646466,2293315159,"Glad to join @BarackObama for a conversation with local corporate leaders &amp; Chicago small business owners.

The @ObamaFoundation is working to prioritize collaboration, implement best practices, address common challenges, &amp; invest in economic success on the South &amp; West Sides. https://t.co/L8QNbFS8to",retweeted,0,ObamaFoundation,0,0,39,2022-10-19T13:45:23.000Z
1582162696694247424,2293315159,"When our youth are given the resources and support they need to break cycles, their opportunities to thrive are endless. 

We loved spending the day with incredible students from all across Chicago. https://t.co/IuPCGk4QC0",,468,ObamaFoundation,5,33,90,2022-10-18T00:12:36.000Z
1582104876871360512,2293315159,"President @BarackObama and @MichelleObama just made their voices heard at the ballot box in Chicago! 

Make sure you get out there and vote. 🗳️ https://t.co/Gm0lNXp4IX",,2864,ObamaFoundation,24,89,370,2022-10-17T20:22:51.000Z
1581648518464274432,2293315159,"#WorldFoodDay is an opportunity to celebrate those who ensure that no one is left hungry—like the community partners that help make our Local Lunchbox program a success. This summer we were able to provide over 70,000 healthy and delicious meals to young people across Chicago! https://t.co/8qcnpNQ8N3",,238,ObamaFoundation,3,7,79,2022-10-16T14:09:27.000Z
1580937927332593664,2293315159,Our commitment to Chicago starts with supporting young people! Last month we hosted our first Shadow Day with @MBK_Alliance and @GirlsAlliance youth at the McDonalds' headquarters. These outings serve as a fun and engaging opportunity to show students different career paths. https://t.co/biLDLRom9P,,222,ObamaFoundation,3,20,62,2022-10-14T15:05:48.000Z
1580936069398159361,2293315159,"It was great speaking with Imani and Austin, two outstanding @UrbanAlliance Obama Youth Jobs Corps students. They’re proof that when we connect young people with training and meaningful work experience, it benefits our communities and the world. https://t.co/6hXjZNsSXx",retweeted,0,ObamaFoundation,0,0,954,2022-10-14T14:58:25.000Z
1580562145892179968,2293315159,"Our #ObamaLeaders programs aim to inspire, empower, and connect regional cohorts of changemakers to make lasting change in their communities. We're accepting applications for our 2023 cohorts in Africa, Asia-Pacific, and Europe until Oct. 21. Apply now: https://t.co/3ExyQ6m8c8 https://t.co/hDWOwa6cNB",,136,ObamaFoundation,3,6,57,2022-10-13T14:12:35.000Z
1580258706654367744,2293315159,"True power comes not from clinging to the past, but from the effort to build a better future. We stand with the brave women and girls in Iran fighting for life and freedom. https://t.co/CgdSKbqnQ8",quoted,266,ObamaFoundation,4,21,86,2022-10-12T18:06:50.000Z
1580221276110594049,2293315159,"Futures Series is an opportunity to  connect South Side high school students with industry experts to help expose them to career paths they may not have been considering. 

Here’s what that’s looking like for the students of Hyde Park Academy: https://t.co/JCTBCyWvbL",,206,ObamaFoundation,5,12,55,2022-10-12T15:38:05.000Z
1579867202010091520,2293315159,"I spoke with @MarsaiMartin and Ingrid Tuy, a student from the @GirlsAlliance community, about our new #GetHerThere campaign and ways we can come together to support girls’ empowerment on the #DayOfTheGirl and beyond. 

Check it out: https://t.co/HxpvIDTvKZ",retweeted,0,ObamaFoundation,0,0,483,2022-10-11T16:11:08.000Z
1579811749913583616,2293315159,"💙 EXCITING news this #DayoftheGirl!
 
@MichelleObama and the @GirlsAlliance are launching #GetHerThere, a new global call to action to empower and educate adolescent girls around the world.
 
Find out how you can answer the call: https://t.co/fRIBAs92mb https://t.co/SB1YlvFvF7",,298,ObamaFoundation,13,21,116,2022-10-11T12:30:47.000Z
1579509108654608386,2293315159,"This Indigenous Peoples' Day, get to know @marysmith828—an Obama Administration alum who is creating new opportunities for Native American girls, while blazing pathways of her own. https://t.co/QklEwZQea5",,193,ObamaFoundation,3,36,61,2022-10-10T16:28:12.000Z
1579469560620654594,2293315159,"We're bringing together #ObamaLeaders and global activists to discuss how we can adapt democracies to a new age!
 
President @BarackObama will join these leaders at the Democracy Forum, in partnership with @Columbia and @UChicago, in NYC on Nov. 17th. Stay tuned for more details!",,322,ObamaFoundation,13,73,96,2022-10-10T13:51:03.000Z
1578405952512004108,2293315159,"Our #ObamaLeaders program offers valuable training and resources to emerging leaders around the 🌍, like Joel. And right now, we're accepting applications for our 2023 cohorts in Africa, Asia-Pacific, and Europe until Friday, Oct. 21. Learn more at https://t.co/3ExyQ64xkA https://t.co/jAmnXUgj1q",,112,ObamaFoundation,5,12,31,2022-10-07T15:24:39.000Z
1578057695252324356,2293315159,"💙 I hope you'll take the time to learn about some of our inspiring Latinx @ObamaFoundation employees.

Like Cristina shares, “Latinx stories are vital to the fabric of our country and they have the power to make us rethink the concepts of race and ethnicity in the U.S.” https://t.co/Rlvm21Q3px",retweeted,0,ObamaFoundation,0,0,28,2022-10-06T16:20:48.000Z
1578053420925304834,2293315159,"Members of the #Latinx community not only hold crucial positions across our organization, they bring a unique perspective that shapes our work every day. This #LatinxHeritageMonth, we asked several of our team members to share their stories. Take a look: 
https://t.co/NkA0hbnSNw",,111,ObamaFoundation,2,8,41,2022-10-06T16:03:49.000Z
1577428821590282242,2293315159,"We are saddened by the loss of Loretta Lynn. In 2013 President Obama awarded her the Presidential Medal of Freedom, noting she ""opened doors for women not only by winning tremendous achievements, but also by raising issues few dared to discuss.” https://t.co/ar2tVkkQYR",,3204,ObamaFoundation,13,74,378,2022-10-04T22:41:52.000Z
1577362996149501957,2293315159,"Hurricane Ian made landfall as a Category 4 storm last week, causing catastrophic damage and widespread flooding. The recovery process will take years—but the need for help on the ground is urgent. If you’re able, please consider helping: https://t.co/lxDCToI39f",,175,ObamaFoundation,5,8,66,2022-10-04T18:20:18.000Z
1577300592933933057,2293315159,"To date, we have over 850 #ObamaLeaders in our network, hailing from over 100 nations and territories. And we're just getting started.
 
We are now accepting applications for our next cohorts in Africa, Asia-Pacific, and Europe. Find out more: https://t.co/EOOdrpg3dy https://t.co/O4CWib9cVY",,134,ObamaFoundation,14,22,61,2022-10-04T14:12:20.000Z
1576934147074899968,2293315159,"Happy anniversary to the man I love! These last 30 years have been an adventure, and I’m grateful to have you by my side. Here’s to a lifetime together. I love you, @BarackObama! ❤️😘 https://t.co/HcDjbLl2x6",retweeted,0,ObamaFoundation,0,0,16470,2022-10-03T13:56:13.000Z
1576934123658416129,2293315159,"Miche, After 30 years, I’m not sure why you look exactly the same and I don’t. I do know that I won the lottery that day—that I couldn’t have asked for a better life partner. Happy anniversary, sweetheart! https://t.co/sYGKPOff1O",retweeted,0,ObamaFoundation,0,0,34627,2022-10-03T13:56:07.000Z
1576627751268028416,2293315159,"Take a look at the progress of the Obama Presidential Center, the people shaping it, and the investment we are making to the place that we call home.
https://t.co/jIFGK7TCZn",replied_to,158,ObamaFoundation,1,7,39,2022-10-02T17:38:42.000Z
1576627582128492545,2293315159,His speech would prove an important moment in his race for Senate and later the presidency. The Obama Presidential Center will feature this and other pivotal events that shaped the Obamas' journey in the context of American history—while challenging visitors to write their own.,replied_to,148,ObamaFoundation,3,7,29,2022-10-02T17:38:02.000Z
1576627348903960579,2293315159,"20 years ago today, then-State Senator @BarackObama declared his opposition to the war in Iraq at a rally in Chicago. At the time, polls showed a majority of the public—including many leaders of his own party—supported the invasion. https://t.co/CXhou8MEQa",,640,ObamaFoundation,20,48,120,2022-10-02T17:37:06.000Z
1576626938617028608,2293315159,"Happy 98th birthday, President Carter! Your dedication to public service and the work you and the @CarterCenter have done to lift up others is an example we should all follow. https://t.co/3bJl9RyUN0",retweeted,0,ObamaFoundation,0,0,10125,2022-10-02T17:35:29.000Z
1575495861294940161,2293315159,"The center will serve as a space for neighbors to access information related to the Obama Presidential Center, participate in career development workshops, and learn about our apprenticeship programs.
 
Thank you to everyone who helped us bring the center to life in Woodlawn! https://t.co/gin3h7FMNu",replied_to,115,ObamaFoundation,0,15,34,2022-09-29T14:40:59.000Z
1575495387166613504,2293315159,"Yesterday, we joined the Lakeside Alliance, elected officials, business owners, and members of the Obama Presidential Center workforce communities for a special ribbon cutting to celebrate the opening of the Lakeside Alliance Resource Center in Woodlawn! https://t.co/SNEe0tdjsQ",,213,ObamaFoundation,2,27,55,2022-09-29T14:39:06.000Z
1575161321867411457,2293315159,"It’s been one year since we officially broke ground on the Obama Presidential Center, and I couldn’t be prouder of the progress we’ve made so far. https://t.co/zdqPdrdrpU",retweeted,0,ObamaFoundation,0,0,2121,2022-09-28T16:31:38.000Z
1575129122942189572,2293315159,"A year ago today, we broke ground for the Obama Presidential Center—symbolizing the beginning of a new chapter for a neighborhood so close to where I grew up. But at the @ObamaFoundation, we're doing things differently as we build this world-class center.
 
Here's how: https://t.co/ax1aTFwNDT",retweeted,0,ObamaFoundation,0,0,75,2022-09-28T14:23:42.000Z
1575126095745236992,2293315159,"One year ago today, after a tremendous amount of hard work, dedication, and support from our Chicago neighbors and people from all around the world, we broke ground on the Obama Presidential Center.
 
Take a look back at that exciting day in Jackson Park! https://t.co/1fbv7gSskK",,339,ObamaFoundation,5,34,82,2022-09-28T14:11:40.000Z
1574476382062743552,2293315159,"This summer, @MBK_Alliance awarded grants to 51 organizations working hard to make a difference for young boys and men of color across the country. 

You can learn more about them here: https://t.co/au5Xa0uyGW https://t.co/Y5qvG0TSQY",retweeted,0,ObamaFoundation,0,0,664,2022-09-26T19:09:56.000Z
1574194502104915975,2293315159,"To all our Jewish friends, family, and neighbors celebrating the start of #RoshHashanah tonight, Shanah Tovah! https://t.co/6mfROu4Tl8",,6432,ObamaFoundation,42,908,917,2022-09-26T00:29:51.000Z
1573318844562669573,2293315159,"This #BannedBooksWeek, we spoke with @uchicago Obama Scholar Rebecca Silverman and her @rosecafechi co-founder Iesha Malone about the power of representation in literature and the corrosive effect silencing diverse storytellers can have. Read more: https://t.co/iyw6u848sK",,160,ObamaFoundation,3,26,50,2022-09-23T14:30:18.000Z
1573031965179187201,2293315159,My heart goes out to the millions being affected by the #PakistanFloods. But what's giving me hope is the everyday people and organizations who are stepping up to help. The @ObamaFoundation has put together a list of ways you can help. https://t.co/1QabVkTzsJ,retweeted,0,ObamaFoundation,0,0,51,2022-09-22T19:30:20.000Z
1572679474751180804,2293315159,"After the catastrophic flooding in Pakistan, millions are displaced, food supplies are low, and more than 660,000 people have taken shelter at relief camps. We've compiled a list of orgs—including @alkhidmatorg, @HI_UnitedStates, @Edhiorg, and @TCFPak—who are accepting donations:",,403,ObamaFoundation,17,33,178,2022-09-21T20:09:40.000Z
1572643770507866112,2293315159,"Last week, our newest cohort of #ObamaScholars from @Uchicago and @Columbia came together in Chicago! During their orientation they got to know one another and planned for what’s ahead. 

Want to know the issue areas these leaders are focusing on? Visit https://t.co/AEoul1BFo5 https://t.co/Sfz6QYJyX0",,176,ObamaFoundation,3,9,53,2022-09-21T17:47:47.000Z
1572603494963777537,2293315159,"Puerto Rico never fully recovered from Hurricane Maria in 2017. Now, millions are without power and shelter in the wake of Hurricane Fiona. We’re thinking of all those affected, and our #MBK family from @FComunitaria and the Loíza Alliance for Peace. Find out how you can help⬇️ https://t.co/dbEUvB1uJy",retweeted,0,ObamaFoundation,0,0,51,2022-09-21T15:07:45.000Z
1572351759623884800,2293315159,"Brigada Solidaria del Oeste, a #PuertoRico based @MutualAidRelief group is collecting emergency donations such as solar lamps, water filters, water purification tablets and first aid kids, as well as monetary donations via Paypal. https://t.co/x9LlXTy4FR",replied_to,75,ObamaFoundation,0,3,34,2022-09-20T22:27:27.000Z
1572351758210400259,2293315159,"The @HispanicFed, a nonprofit supporting Latino communities across the country, is providing on-the-ground emergency relief and essential supplies after #HurricaneFiona. https://t.co/dO9k0vrKZl",replied_to,86,ObamaFoundation,3,3,39,2022-09-20T22:27:26.000Z
1572351756503490561,2293315159,PRxPR is a disaster and rebuild relief fund that launched after Hurricane Maria in 2017. @prxprorg works with local organizations across the island to help rebuild infrastructure and provide humanitarian needs.  https://t.co/sz1wcpznnE,replied_to,76,ObamaFoundation,3,1,32,2022-09-20T22:27:26.000Z
1572351755068776449,2293315159,"The organizations threaded below are accepting donations to provide medical and hygiene kits, food, shelter, and more to families in need after #HurricaneFiona.

If you’re able, we hope you’ll consider pitching in to help the victims of #PuertoRico and beyond:",,340,ObamaFoundation,3,13,188,2022-09-20T22:27:25.000Z
1572221689714319360,2293315159,"11 years ago #OTD, “Don’t Ask, Don’t Tell”—a discriminatory ban on gay, lesbian, and bisexual service members—was officially repealed under President @BarackObama, allowing Americans to serve their country openly without hiding who they are. https://t.co/JZiSnXlTJG",,307,ObamaFoundation,5,19,82,2022-09-20T13:50:35.000Z
1572194072923602947,2293315159,Wow! So exciting stopping by the construction site for the future Obama Presidential Center in Jackson Park! I’m blown away by our incredible and diverse construction team and all the progress they’ve made! Only more good things to come! https://t.co/4gxJY7BXkU,retweeted,0,ObamaFoundation,0,0,62,2022-09-20T12:00:51.000Z
1571854787343273986,2293315159,"Michelle and I were lucky enough to know Her Majesty The Queen. Back when we were just beginning to navigate life as President and First Lady, she welcomed us to the world stage with extraordinary generosity. Our thoughts are with the Royal Family and those mourning her passing. https://t.co/pHzpUJwgYb",retweeted,0,ObamaFoundation,0,0,7850,2022-09-19T13:32:39.000Z
1570505905569157121,2293315159,"On #InternationalDemocracyDay, revisit President @BarackObama’s reflection on the importance of a positive vision for democracy and the promise of the next generation to chart a better course. https://t.co/hYeki1UmQl",,488,ObamaFoundation,8,29,149,2022-09-15T20:12:41.000Z
1570423835861852162,2293315159,"This #LatinxHeritageMonth we're celebrating the Latinx and Hispanic voters, campaign volunteers, and administration staff who helped make President Obama's historic path to the White House possible. These are the types of stories we'll tell at the Obama Presidential Center. https://t.co/z58YwWxnlt",,266,ObamaFoundation,3,15,78,2022-09-15T14:46:34.000Z
1570423279046868994,2293315159,"Today I’m in NYC at the @Forbes 10th Annual Power Women’s Summit!  I’ll be interviewed by @RandallLane about how the @ObamaFoundation is helping the next generation of women find the power of their voices and lead.
 
🎟️ Follow along!#FORBESWOMEN https://t.co/KbBdDpjnzc",retweeted,0,ObamaFoundation,0,0,37,2022-09-15T14:44:21.000Z
1569741151766290432,2293315159,"Former President @BarackObama and @bchesky surprised the first class of “Voyager Scholarship” recipients, awarding 100 college students with financial aid and travel stipends to pursue public service. https://t.co/LbziZ6lmYp",retweeted,0,ObamaFoundation,0,0,74,2022-09-13T17:33:49.000Z
1569728902766919682,2293315159,Congrats to the first class of Voyager Scholarship recipients. I’m excited to see the good they can do in communities around the world https://t.co/W3l9589Nlk,retweeted,0,ObamaFoundation,0,0,71,2022-09-13T16:45:09.000Z
1569728808659337220,2293315159,"Ready for my next chapter! 

Thrilled to share I have been awarded the #voyagerscholarship for public service created by the Obamas and Brian Chesky. I’m so excited to represent the inaugural class of Voyagers! https://t.co/LeDMVkRqb6",retweeted,0,ObamaFoundation,0,0,12,2022-09-13T16:44:46.000Z
1569725161016037376,2293315159,Thank you to the Obamas and Brian Chesky for creating the #VoyagerScholarship for Public Service! I'm ready to continue learning how I can help expand health equity through access to culturally competent care for marginalized communities. https://t.co/zBsMHOSj7M,retweeted,0,ObamaFoundation,0,0,21,2022-09-13T16:30:17.000Z
1569705707007614977,2293315159,"Thrilled to share I have been awarded the #VoyagerScholarship, created by the Obamas and Airbnb's Brian Chesky. I'm ready to continue learning how I can help expand access to basic hygiene necessities and education in underserved and marginalized communities while at @RutgersU. https://t.co/pHWYR1XudM",retweeted,0,ObamaFoundation,0,0,25,2022-09-13T15:12:58.000Z
1569705430426783745,2293315159,"WOW! Feeling inspired after getting to know the inaugural class of 100 Voyagers! Thank you @MichelleObama, @BarackObama, and @bchesky for dreaming up the #VoyagerScholarship to support the next generation of public service leaders. https://t.co/KtlWnm2kJl",retweeted,0,ObamaFoundation,0,0,34,2022-09-13T15:11:52.000Z
1569705243654455300,2293315159,"Congratulations to Centre College's Gloria Lwin '24 on being named to the inaugural class of Voyager Scholars, a group of 100 service-driven college leaders who are the first to receive the Obama-Chesky Scholarship for Public Service. #VoyagerScholarship https://t.co/EKLuaPWfBT",retweeted,0,ObamaFoundation,0,0,18,2022-09-13T15:11:08.000Z
1569669963538997248,2293315159,"Barack, @BChesky, and I are thrilled to announce the 100 young leaders who will be the first-ever recipients of our Voyager Scholarship. These changemakers are making a difference in their communities and are eager to pursue careers in public service. https://t.co/bIU631MJvP",retweeted,0,ObamaFoundation,0,0,541,2022-09-13T12:50:57.000Z
1569664750593662978,2293315159,"100 college students who are ready to pick up the baton of change through public service have started their journeys as the inaugural class of Voyagers!
 
Created by the Obamas and @Airbnb’s @bchesky, the #VoyagerScholarship will support a new generation of changemakers.",,210,ObamaFoundation,11,9,59,2022-09-13T12:30:14.000Z
1568960864564150274,2293315159,Today we remember the victims of the 9/11 terrorist attacks. To ensure that future generations #NeverForget—both the victims and the way Americans united after the attacks—President @BarackObama proclaimed September 11th as a National Day of Service in 2013. https://t.co/00BJxPhouL,,982,ObamaFoundation,4,18,187,2022-09-11T13:53:14.000Z
1568642565745827840,2293315159,⏪ Take a look at the historic unveiling of the President and Mrs. Obama’s official White House portraits—created by Robert McCurdy and Sharon Sprung. https://t.co/TrNR3NDfzd,,2873,ObamaFoundation,44,105,495,2022-09-10T16:48:26.000Z
1568359046775980033,2293315159,"Yesterday, @BarackObama reflected on Queen Elizabeth II's passing and noted the grace, dignity, and work ethic she displayed over seven decades.

In recognition of her life and legacy, take a look at some moments she shared with President and Mrs. Obama: https://t.co/OZKLxnmXTR",,615,ObamaFoundation,4,19,118,2022-09-09T22:01:50.000Z
1567957237515304960,2293315159,"""Michelle and I are grateful to have witnessed Her Majesty’s dedicated leadership, and we are awed by her legacy of tireless, dignified public service.""
 
Read President and Mrs. Obama's statement on the passing of Her Majesty Queen Elizabeth II:
https://t.co/Qo1wHpogJ5",,1953,ObamaFoundation,8,30,285,2022-09-08T19:25:11.000Z
1567885550694158336,2293315159,"From this day forward, the official portraits of former President Obama and former First Lady Obama will now display on the walls of the White House – the People’s House – forever. https://t.co/Ceb0wR4Ya2",retweeted,0,ObamaFoundation,0,0,10874,2022-09-08T14:40:19.000Z
1567719817481781250,2293315159,"When future generations see these portraits by Robert McCurdy and Sharon Sprung in the White House, I hope they get a better, honest sense of who Michelle and I were. And I hope they leave with a deeper understanding that if we could make it, they can do remarkable things, too. https://t.co/3Eo1WNr31b",retweeted,0,ObamaFoundation,0,0,7397,2022-09-08T03:41:45.000Z
1567719793788174336,2293315159,"Today, Barack and I went back to the White House to unveil our official portraits. It was so exciting to share Sharon Sprung and Robert McCurdy's incredible artistry with the world—and to be back in the place we called home for eight years. https://t.co/YF98lihqgy",retweeted,0,ObamaFoundation,0,0,11181,2022-09-08T03:41:40.000Z
1567609859587047426,2293315159,"Sharon Sprung is a brilliant artist who joins a small, but mighty group of women who have painted an official White House portrait. Learn more about her and the process that went into making our portraits: https://t.co/NVAN3G0WpV",retweeted,0,ObamaFoundation,0,0,2235,2022-09-07T20:24:49.000Z
1567609848182853633,2293315159,"I want to thank Robert McCurdy for his extraordinary work on my portrait. Robert is known for his paintings of public figures, and I love how he paints people exactly the way they are. Take a look at the process behind creating the official White House portraits: https://t.co/oZb6ov4uwr",retweeted,0,ObamaFoundation,0,0,4586,2022-09-07T20:24:47.000Z
1567581818731241474,2293315159,"A historic day. Today, President and Mrs. Obama unveiled their official White House portraits in a special ceremony at the White House. We sat down with Robert McCurdy and Sharon Sprung, the artists behind the portraits, to hear how it all came together. https://t.co/diUmvJmiCI",,1535,ObamaFoundation,24,40,365,2022-09-07T18:33:24.000Z
1567581090713403392,2293315159,“This day isn’t about me or Barack…it’s not even about these beautiful paintings. It’s about telling that fuller story—a story that includes every single American…so that our kids and grandkids can see something more for themselves.” —@MichelleObama,retweeted,0,ObamaFoundation,0,0,142,2022-09-07T18:30:30.000Z
