tweet_id,author_id,text,tweet_type,like_count,company_name,quote_count,reply_count,retweet_count,created_at
1461448768189079557,2293315159,"When it comes to climate change, we can’t afford to go backward—or even stay where we are. If we are going to act on the scale that’s required to combat this climate crisis, we all need to step up and meet this moment together. https://t.co/jyk0ZBcv0S",retweeted,0,ObamaFoundation,0,0,1681,2021-11-18T21:38:33.000Z
1461357863004106756,2293315159,"“It can be tough to change the status quo and at times it can be really lonely. Knowing you can call on a whole community of people, it means a lot.” —@NimaTisdall, one of the passionate #ObamaLeaders who joined President @BarackObama for a #ClimateCrisis discussion in Glasgow. https://t.co/Ulykx69q2S",,934,ObamaFoundation,28,112,217,2021-11-18T15:37:19.000Z
1461017890187005957,2293315159,"Ten years ago, @BarackObama called for training 100k new #STEM teachers by 2021 to reduce disparities in K-12 education. This week, @100kin10, a coalition formed to answer that call, announced they exceeded the President’s ambitious goal. Read more at: https://t.co/LF9Rr5qXXP",,297,ObamaFoundation,4,17,83,2021-11-17T17:06:24.000Z
1461017552746954754,2293315159,"In 2011, my Administration made a pledge to prepare 100,000 new STEM teachers over the next 10 years. I couldn't be prouder to hear that @100Kin10 not only met that goal, but trained an additional 8,000 teachers who will make a difference for our kids. https://t.co/NI2J779IYS https://t.co/uLqbuRjEeF",retweeted,0,ObamaFoundation,0,0,2035,2021-11-17T17:05:03.000Z
1460638914927026182,2293315159,Join us in welcoming the newest class of #ObamaLeaders from across Africa! Focusing on a broad range of issue areas from public health to women’s rights—these leaders are ready to work together to address their communities' most pressing needs. https://t.co/tmLZKGJ3Iu https://t.co/XjtjFm6IIu,,466,ObamaFoundation,36,59,129,2021-11-16T16:00:29.000Z
1460288159388995592,2293315159,"Congratulations to Chicago's @ugrowcollective (formerly Growing Power) for winning #COP26's Climate Change Cup—a competition celebrating innovative local solutions to global climate issues.
 
Back in 2017, we spoke with Erica Allen, the organization’s co-founder. Take a look: https://t.co/gHYB6HW9L8",,160,ObamaFoundation,2,20,57,2021-11-15T16:46:42.000Z
1459217501187887108,2293315159,"On #VaccinationAwarenessDay in our hometown, find out where you, your family, and friends can get vaccinated to help #ProtectChicago.
 
As we continue to navigate #COVID19, we are guided by one of President Obama's earliest messages: there is always hope. https://t.co/6jRwiNOk06",,144,ObamaFoundation,2,21,54,2021-11-12T17:52:17.000Z
1459174479951802371,2293315159,"Naomi Davis, founder of the nonprofit @BlacksInGreen, is dedicated to making the South Side more environmentally sustainable. Before Chicago’s winter hits, Naomi and her team need help finding homes for a collection of trees. Read more from @BlockClubCHI: https://t.co/oyrHMVoN55",,175,ObamaFoundation,2,10,70,2021-11-12T15:01:20.000Z
1459172621845766153,2293315159,My Brother’s Keeper is expanding! We are looking for people who are passionate about improving the lives of our boys and young men of color. Apply today and begin to make your lasting impact.,retweeted,0,ObamaFoundation,0,0,60,2021-11-12T14:53:57.000Z
1458800658488963080,2293315159,"To every veteran and their family, we thank you for your service and sacrifice to our country. https://t.co/4EYWe9pRvV",retweeted,0,ObamaFoundation,0,0,5758,2021-11-11T14:15:54.000Z
1458782725834522627,2293315159,"After serving in the Marine Corps, Tom Voutsos found a new calling to community work—from helping end the cycle of gang violence @TRUColorsBrew to solving housing issues with his organization @LadderUpHousing. This #VeteransDay, get to know the @UChicago Obama Foundation Scholar.",,239,ObamaFoundation,4,10,56,2021-11-11T13:04:39.000Z
1458521816796995586,2293315159,"Young people have more at stake in the fight against climate change than anyone else. I had a chance to talk with some young people who are helping lead the fight, and could not be more impressed by their courage, creativity, and persistence. They give me hope. https://t.co/muFbKl5WcF",retweeted,0,ObamaFoundation,0,0,2264,2021-11-10T19:47:53.000Z
1458439987142221825,2293315159,"Next week, we’re excited to announce the newest group of changemakers that will join our Leaders Africa cohort. Stay tuned for updates! https://t.co/qdO4ASK7Rb",replied_to,141,ObamaFoundation,1,9,25,2021-11-10T14:22:44.000Z
1458439980813103106,2293315159,"In 2018, we launched our Leaders Africa program. Hailing from 44 countries across the continent, these emerging leaders brought a plethora of skills and experiences to share with one another to increase their social impact. https://t.co/qfB15aN6qG",,245,ObamaFoundation,3,16,60,2021-11-10T14:22:42.000Z
1458438754310541315,2293315159,"I spoke at COP26 in Glasgow about what’s happened in the six years since the Paris Agreement, and how much further we still need to go to control climate change. https://t.co/an9xxwrOQC",retweeted,0,ObamaFoundation,0,0,2623,2021-11-10T14:17:50.000Z
1458185234579603483,2293315159,"After speaking to delegates about the urgent need to address the climate crisis at #COP26, President @BarackObama joined a group of #ObamaLeaders working on the frontlines of #ClimateChange for an energizing discussion.

📸 Here's a look at yesterday's conversation: https://t.co/nG60NEwHwT",,431,ObamaFoundation,9,29,113,2021-11-09T21:30:26.000Z
1458105203035721732,2293315159,"Find out what makes our revamped, all-virtual Obama Foundation Leaders Program so special. Then learn how you can be part of our #ObamaLeaders network at https://t.co/UzsARFS5Nv https://t.co/J66CgZDOxh",,187,ObamaFoundation,1,14,62,2021-11-09T16:12:25.000Z
1457832109972787201,2293315159,"🌏 Inspiring words from Sheila Babauta, one of our #ObamaLeaders, as she set the stage for @BarackObama’s remarks at #COP26 in Glasgow earlier today. https://t.co/Ueqf809wrd",,276,ObamaFoundation,2,13,84,2021-11-08T22:07:14.000Z
1457713839009566720,2293315159,"We’ve done some important work since the Paris Agreement was signed six year ago, but we’re still nowhere near where we need to be on climate. Watch live from #COP26 in Glasgow as I talk about the steps we can take to combat climate change. https://t.co/fpoGbnNehm",retweeted,0,ObamaFoundation,0,0,2669,2021-11-08T14:17:16.000Z
1457710856951767043,2293315159,"🔴  Live from #COP26

Former President of the USA @BarackObama addresses delegates in Glasgow.   https://t.co/80m8RQOpbl",retweeted,0,ObamaFoundation,0,0,199,2021-11-08T14:05:25.000Z
1456637270237368326,2293315159,"Next Monday at #COP26, @BarackObama will meet with climate activists—including a number of #ObamaLeaders—for a discussion on how this generation is leading the fight against climate change. Learn more about the work that remains to address the crisis at https://t.co/9Thw2BZg1d https://t.co/xSjtlt94bm",,197,ObamaFoundation,0,17,84,2021-11-05T14:59:22.000Z
1456636754119827460,2293315159,"Five years ago, the Paris Agreement went into effect. Paris provided an important framework in the fight against climate change, but it wasn’t enough. That’s why I’ll be speaking in Glasgow on Monday about the road ahead and what young people in particular can do to help. https://t.co/E7P3X6jtny",retweeted,0,ObamaFoundation,0,0,2019,2021-11-05T14:57:19.000Z
1456315935695020036,2293315159,"“If you’re disproportionately impacted by the problem, you should have a disproportionate role in the solution.” —@lisapjackson, Former EPA Administrator
 
On the anniversary of the Paris Agreement, read more about the Obama Administration’s work to address the climate crisis:",,150,ObamaFoundation,2,20,57,2021-11-04T17:42:30.000Z
1456273635786694665,2293315159,"Happy #Diwali to those celebrating!
 
In 2009, @BarackObama became the first president to celebrate the Festival of Lights at the White House, kindling the diya—a lamp that symbolizes how darkness will always be overcome by light. https://t.co/mmcMY2iYB3",,1147,ObamaFoundation,9,25,212,2021-11-04T14:54:25.000Z
1455919758008803332,2293315159,"As #COP26 continues, we’re thinking about our own commitments to #sustainability. From the way the Obama Presidential Center is being built to our support of young leaders addressing #ClimateChange—we are committed to doing our part for a cleaner planet. https://t.co/txISVCwjRQ",,138,ObamaFoundation,1,12,57,2021-11-03T15:28:14.000Z
1455540096288137229,2293315159,📢 @MichelleObama on giving back to the South Side through the Obama Presidential Center. https://t.co/Y10tUqUKLN,,691,ObamaFoundation,4,13,136,2021-11-02T14:19:36.000Z
1455204978679758851,2293315159,"Very excited to join with the @ObamaFoundation at #COP26 to host @BarackObama for a roundtable with youth activists including @columbia and @ColumbiaSIPA students! https://t.co/nAibQQvfeU

We’re also hosting in-person and virtual events, join them here! https://t.co/EdqjZod8Md https://t.co/cEGmEKpVff",retweeted,0,ObamaFoundation,0,0,47,2021-11-01T16:07:57.000Z
1454810744265060352,2293315159,👻 Wishing everyone a safe and fun Halloween! https://t.co/7nmKzYiUEk,,3115,ObamaFoundation,11,35,311,2021-10-31T14:01:25.000Z
1454163395041808388,2293315159,"Signing the Paris Agreement to fight climate change was one of my proudest moments in office. But it was always a foundation to build on. As world leaders gather for COP26, I shared some reflections on the road to Paris and the young activists who are pushing us further. https://t.co/EebSdTQ6QS",retweeted,0,ObamaFoundation,0,0,2492,2021-10-29T19:09:05.000Z
1454163274602360837,2293315159,"Change can happen. We have come far, but we have many miles to go before our work is done. https://t.co/BIOfsDlw6Z",retweeted,0,ObamaFoundation,0,0,36,2021-10-29T19:08:36.000Z
1454163094285045762,2293315159,"Five years ago this week, the Paris Climate Agreement took effect. To mark this milestone, we asked Obama Administration alumni, #ObamaLeaders on the front lines, and @BarackObama, to reflect on the path to Paris and the work that remains.",,186,ObamaFoundation,2,11,68,2021-10-29T19:07:53.000Z
1454115858335338502,2293315159,"When it comes to the fight against climate change we have no time to lose. To mark the upcoming anniversary of the Paris Climate Agreement, hear from @BarackObama how it came about and why the next generation of leaders offer hope for a more sustainable future. https://t.co/hDwEpAyi8s",,234,ObamaFoundation,7,11,85,2021-10-29T16:00:11.000Z
1453036940140417025,2293315159,"Trenton's first mentor in his life was his father. But, when @champsmentoring got involved with his school — it made all the difference showing the importance of brotherhood. Trenton went on to be the Valedictorian of his 8th-grade class. https://t.co/bpqaf6JKik",retweeted,0,ObamaFoundation,0,0,42,2021-10-26T16:32:57.000Z
1453036877938888706,2293315159,Our hope for the Obama Presidential Center is that it inspires young people like @ChiPubSchools sophomore Trenton Banks to shape their own future. https://t.co/r1xdqjXhTC,,206,ObamaFoundation,4,11,49,2021-10-26T16:32:42.000Z
1452700617688895497,2293315159,"“Being a part of the Obama Scholars program will support the work we’re doing at @GageParkLatinx because I will become a stronger leader, thinking critically about issues and knowing how to mobilize.”
 
Get to know Samantha Martinez, one of our newest #ObamaScholars at @UChicago: https://t.co/mRLB4suO3K",,157,ObamaFoundation,1,9,49,2021-10-25T18:16:31.000Z
1451623989449793549,2293315159,"“No one is too small to have an impact and change the world. So do everything you can.” —@GretaThunberg

⏪  #FlashbackFriday to when environmental activist Greta Thunberg visited with @BarackObama to highlight the progress her generation is making towards #ClimateAction. https://t.co/9wYH2CNfRQ",,299,ObamaFoundation,3,15,97,2021-10-22T18:58:23.000Z
1451286052984008709,2293315159,Glad I had a chance to talk with our new champs! I really am proud of this team and their work this season. https://t.co/rHwqreQMpi,retweeted,0,ObamaFoundation,0,0,1243,2021-10-21T20:35:33.000Z
1451257351030382601,2293315159,"Girls in Afghanistan continue to face danger and significant barriers to their education. In response to this critical moment, @girlsalliance launched the Afghanistan Relief Fund this week to support on-the-ground organizations. Find out how you can help: https://t.co/ZjD64JGX31",,107,ObamaFoundation,0,12,39,2021-10-21T18:41:30.000Z
1450533927471431688,2293315159,The 2022-2023 application for Columbia World Projects’ @ObamaFoundation Scholars Program is now open! Apply today. https://t.co/dFHJQLXnMQ https://t.co/HVvl2MYO71,retweeted,0,ObamaFoundation,0,0,52,2021-10-19T18:46:52.000Z
1450524409270312964,2293315159,"Don’t miss your chance to apply to the #ObamaScholars program—a one-year academic experience at @Columbia.
 
Applications are open to U.S. citizens and residents, in addition to emerging leaders from around the world. Apply now: https://t.co/EqgfsPbNw4",,180,ObamaFoundation,4,16,93,2021-10-19T18:09:03.000Z
1450172527892996100,2293315159,"Colin Powell's lifelong dedication to service, strength and dignity inspired countless boys and young men of color to reach for their dreams. Our thoughts are with his family. https://t.co/tsZsL3Oovj",retweeted,0,ObamaFoundation,0,0,64,2021-10-18T18:50:48.000Z
1450149984540708865,2293315159,"I am deeply saddened by the death of Colin Powell. He was the consummate public servant who placed country over politics. Knowing being “a first” carried extra responsibilities, he always exuded character, integrity &amp; the strength of his convictions. Thank you, for your service. https://t.co/nehbDy7WPT",retweeted,0,ObamaFoundation,0,0,222,2021-10-18T17:21:13.000Z
1450149919629713420,2293315159,"General Colin Powell understood what was best in this country, and tried to bring his own life, career, and public statements in line with that ideal. Michelle and I will always look to him as an example of what America—and Americans—can and should be. https://t.co/vSxTbUE5aR",retweeted,0,ObamaFoundation,0,0,9648,2021-10-18T17:20:57.000Z
1449871337800011776,2293315159,"Congrats to our new WNBA champs, @ChicagoSky! I couldn’t be prouder of this team — they worked hard for this moment, and have made our city proud. https://t.co/Da9cLtvSX4",retweeted,0,ObamaFoundation,0,0,3244,2021-10-17T22:53:58.000Z
1449151994376163331,2293315159,"Before #LatinxHeritageMonth comes to an end, read some of the inspiring stories of family, tradition, and resilience from our Latinx Foundation staff members—who are critical to the work we do: https://t.co/vHxPvdit6E https://t.co/GBLZBX1kFj",,165,ObamaFoundation,0,14,59,2021-10-15T23:15:34.000Z
1448994861764517890,2293315159,"Quoting civil rights leaders Dr. King &amp; John Lewis, honoree Michelle Obama cited we must not only get into “good trouble” but also understand we are in an “inescapable network of mutuality… a single garment of destiny.” https://t.co/oPfAI67rWV",retweeted,0,ObamaFoundation,0,0,114,2021-10-15T12:51:10.000Z
1448464106328109059,2293315159,"I knew Tim my entire life. It's hard to put into words what Tim meant to not only me, but the South Side of Chicago. I saw him just a few months ago when he and my 93 year old Mom were on a panel together sharing their incredible pearls of wisdom. He lived a truly inspiring life https://t.co/z786SZCL3l",retweeted,0,ObamaFoundation,0,0,42,2021-10-14T01:42:08.000Z
1448386542368698368,2293315159,"I'm heartbroken to say goodbye to my friend and mentor, Timuel Black. Tim made Chicago and our world a better place. You will be deeply missed, but your legacy will rightfully live on. 2 Timothy 4:7-8. Read my full statement: https://t.co/YvLxehzzbZ",retweeted,0,ObamaFoundation,0,0,81,2021-10-13T20:33:56.000Z
1448373979463528458,2293315159,"Today we lost Dr Timuel Black, a beloved South Side icon, renowned historian, and friend of the Foundation.
 
Our condolences are with his family during this painful time. Read @BarackObama’s message about Tim: https://t.co/ur2a3WrO4X",,278,ObamaFoundation,1,17,57,2021-10-13T19:44:00.000Z
1448290952465027083,2293315159,Congratulations to my dear friend on this distinguished and well-deserved honor! https://t.co/Pw30cbxpn4,retweeted,0,ObamaFoundation,0,0,93,2021-10-13T14:14:05.000Z
1448282984302448640,2293315159,"The fight for civil rights continues to evolve, but the premise remains the same: Equality for all. During the National Civil Rights Museum’s virtual #30thFreedomAward Ceremony tomorrow, @NCRMuseum will honor @MichelleObama for her inspiring work to build a more equitable world. https://t.co/COBnatJjcP",,1123,ObamaFoundation,14,42,217,2021-10-13T13:42:25.000Z
1447984869938798597,2293315159,"Dive deeper into the tremendous planning and collaboration that has gone into bringing the Obama Presidential Center to life, including never-before-seen interviews with architects Billie Tsien and Tod Williams. https://t.co/q2rdJmPk1x",,333,ObamaFoundation,11,19,96,2021-10-12T17:57:49.000Z
1447597159638052871,2293315159,"We know when girls get the opportunities they deserve, amazing things start to happen. This International #DayoftheGirl, we’re joining @girlsalliance in celebrating girls’ empowerment &amp; education around the 🌍
 
Support the Girls Opportunity Alliance now: https://t.co/XspOfO9JLd",,401,ObamaFoundation,215,39,147,2021-10-11T16:17:12.000Z
1447596764392005642,2293315159,"Happy International #DayoftheGirl! Three years ago today, the @ObamaFoundation launched the @GirlsAlliance to empower adolescent girls through education. I hope you’ll join us to support the next generation of girl power—today and every day. https://t.co/0QKHkhCDnZ",retweeted,0,ObamaFoundation,0,0,91,2021-10-11T16:15:38.000Z
1447595594483216391,2293315159,"Happy International #DayoftheGirl! Today I’m celebrating the promise that exists within every girl. When we invest in that promise, we empower them to change their communities for the better. Join me and the @GirlsAlliance in supporting girls’ education: https://t.co/dwyLjHlyo7 https://t.co/mVYsPN8onA",retweeted,0,ObamaFoundation,0,0,1780,2021-10-11T16:10:59.000Z
1447561847356407815,2293315159,"Throughout his career, Joseph Kunkel has been improving communities through culturally-responsive design. On #IndigenousPeoplesDay, get to know the 2019 Obama Fellow and director of @MASSDesignLab.
 
Learn more: https://t.co/aJVLizk6Dc https://t.co/bXitM1hEPQ",,176,ObamaFoundation,1,16,63,2021-10-11T13:56:53.000Z
1447352598416306180,2293315159,Playoff baseball is back tonight on the South Side of Chicago and we couldn’t be more excited for the @whitesox and their fans—the kind of people that make this city go. Here’s a special message from @BarackObama to his favorite team. Let’s go Sox! https://t.co/3GRcXyYKlU,quoted,779,ObamaFoundation,2,19,117,2021-10-11T00:05:24.000Z
1446217232837664774,2293315159,"And of course, I’m excited for my @WhiteSox to be back in the playoffs. It’s going to be hard to top a walk-off home run on the Field of Dreams, but if any team can do it, it’s this one. Go Sox! https://t.co/vymsDfGpCW",retweeted,0,ObamaFoundation,0,0,700,2021-10-07T20:53:52.000Z
1446217219705290754,2293315159,"It’s always good to be from Chicago, but this year is especially sweet. Congratulations to the @ChicagoSky for making it to the WNBA finals, and to the legend, @Candace_Parker, for making all of us proud. We’ll be rooting for you. https://t.co/yW4d1OUYpF",retweeted,0,ObamaFoundation,0,0,1645,2021-10-07T20:53:49.000Z
1446204133468409856,2293315159,"Recently we broke ground in Jackson Park, making way for the Obama Presidential Center on the South Side of Chicago. But long before the shovels hit the dirt, extensive planning, designing, and dreaming went into making this moment a reality.

Take a closer look at the journey: https://t.co/Xqqk4TPZTW",,929,ObamaFoundation,27,39,211,2021-10-07T20:01:49.000Z
1445916317123547138,2293315159,"Here at the Obama Foundation, members of the Latinx community not only hold crucial positions across our organization, they bring a unique perspective that shapes our work every day. Join us in celebrating #LatinxHeritageMonth, by reading some of their inspiring stories:",,210,ObamaFoundation,8,10,66,2021-10-07T00:58:08.000Z
1445791974452252675,2293315159,"Last week @BarackObama and @MichelleObama had fun surprising some hardworking women from the Chicago Women in Trades. Together, they thanked these women for their work to build the Obama Presidential Center and the example they are setting for other women in trades. https://t.co/7DzAJtJa2W",,300,ObamaFoundation,3,10,83,2021-10-06T16:44:02.000Z
1444782367084736512,2293315159,"Happy anniversary, Miche! Over the past 29 years, I've loved watching the world get to know you not just as a daughter of the South Side, but as a mother, lawyer, executive, author, First Lady, and my best friend. I can’t imagine life without you. https://t.co/SEXc9jMXPl",retweeted,0,ObamaFoundation,0,0,17575,2021-10-03T21:52:13.000Z
1444701480515158018,2293315159,"💙 29 years ago, the Obamas danced the night away at the South Shore Cultural Center after saying “I do.” Fast forward to last week, where they broke ground on the Obama Presidential Center just a few miles away. Happy wedding anniversary @BarackObama and @MichelleObama! https://t.co/0mHT2HVAV5",,1599,ObamaFoundation,10,45,211,2021-10-03T16:30:48.000Z
1444701086695182340,2293315159,"How it started vs. how it’s going

Happy anniversary, Barack—love you! ❤️😘 https://t.co/fHL8MX2MIm",retweeted,0,ObamaFoundation,0,0,22738,2021-10-03T16:29:14.000Z
1444394911571316748,2293315159,Congratulations @BarackObama and @MichelleObama! Looking forward to visiting. https://t.co/JpRILwtJWz,retweeted,0,ObamaFoundation,0,0,875,2021-10-02T20:12:37.000Z
1443952369641918468,2293315159,"On Tuesday, we broke ground on the Obama Presidential Center in Jackson Park—now the work begins to bring hope home to the South Side of Chicago. Thank you @GovPritzker, @ChicagosMayor, and the thousands who watched from home. https://t.co/TDwpkuJIg0",,878,ObamaFoundation,11,55,181,2021-10-01T14:54:06.000Z
1443950494024613909,2293315159,"I have too many favorite #ObamaMemories to count, but this one is up there. Congratulations to @barackobama and @michelleobama for breaking ground this week on the Obama Presidential Center—a place to continue empowering the next generation of leaders with the @obamafoundation. https://t.co/ViGQMbE3cq",retweeted,0,ObamaFoundation,0,0,1502,2021-10-01T14:46:39.000Z
1443624636739096582,2293315159,"Let your guard down, build authentic relationships in your community, and find support in one another. That’s just some of the advice the Obamas had for the newest class of #ObamaScholars from @UChicago. https://t.co/nS8dDfXF1S",,294,ObamaFoundation,6,21,90,2021-09-30T17:11:49.000Z
1443265964670439432,2293315159,"""Who you are right now is not who you are going to be in 20 years, so practice all kinds of things in your lives."" —@MichelleObama

Yesterday, the Obamas sat down with @ChiPubSchools students to share some wisdom after breaking ground on the Obama Presidential Center nearby. https://t.co/Gti7QaF3R8",,452,ObamaFoundation,6,20,102,2021-09-29T17:26:35.000Z
1443245921333039107,2293315159,Congratulations President Obama! https://t.co/ALYVnuJpsn,retweeted,0,ObamaFoundation,0,0,87,2021-09-29T16:06:56.000Z
1442999071506063363,2293315159,"One of the greatest honors of my life is being a proud Chicagoan—a daughter of the South Side. When it came time to decide where Barack and I would build the Obama Presidential Center, we knew it had to be in the place we call home. We can’t wait to see this project come to life. https://t.co/JOC6Vcfeji",retweeted,0,ObamaFoundation,0,0,2872,2021-09-28T23:46:02.000Z
1442984431854051334,2293315159,"Today, we officially broke ground on the Obama Presidential Center on the South Side of Chicago. Michelle and I can’t imagine a better investment in the city we love, and generations of young leaders who will help create change. https://t.co/cmyD0pD4jy",retweeted,0,ObamaFoundation,0,0,7010,2021-09-28T22:47:52.000Z
1442933035272265729,2293315159,"“It’s not just breaking ground on a new building, it’s breaking ground on the very idea of America as a place of possibilities.” —President Biden

Thank you @POTUS for joining our groundbreaking ceremony for the  Obama Presidential Center today! https://t.co/KnhXfJVeXQ",,815,ObamaFoundation,11,34,229,2021-09-28T19:23:38.000Z
1442916650685120513,2293315159,Bringing Hope Home: Obama Presidential Center Groundbreaking Ceremony https://t.co/bffNcjRTq7,,749,ObamaFoundation,22,48,236,2021-09-28T18:18:32.000Z
1442915637521641473,2293315159,"Michelle and I had fun surprising some of the hardworking women from the Chicago Women of Trades. We’re grateful for the work they're doing — not only to build the Obama Presidential Center, but also to make it easier for more people to follow their example. https://t.co/pEc1qYDDdv",retweeted,0,ObamaFoundation,0,0,2334,2021-09-28T18:14:30.000Z
1442912017635893251,2293315159,"Join our friends at the @ObamaFoundation for the groundbreaking of the Obama Presidential Center, which will include a new CPL branch! https://t.co/TMK7GIwNw9",retweeted,0,ObamaFoundation,0,0,59,2021-09-28T18:00:07.000Z
