tweet_id,author_id,text,tweet_type,like_count,company_name,quote_count,reply_count,retweet_count,created_at
1317168257397346304,2293315159,"On #WorldFoodDay, I wanted to celebrate some of the Chicagoans who are feeding their neighbors. Times are tough for so many people in our city right now, and these heroes are working hard to make sure others don’t have to worry about where their next meal might come from.",retweeted,0,ObamaFoundation,0,0,52,2020-10-16T18:19:19.000Z
1317132838400086018,2293315159,"On days like #WorldFoodDay, we are especially grateful for Obama Leaders like Michael who are committed to fighting hunger. To learn how you can support @lagosfoodbank's work, visit https://t.co/iZ6roVzkhl. https://t.co/fdCxbtpQRH",replied_to,142,ObamaFoundation,0,9,32,2020-10-16T15:58:34.000Z
1317132836734963717,2293315159,"When COVID-19 began to spread, Michael had to quickly shift his operations in order to safely continue to support his community. Through fundraising and partnerships, @lagosfoodbank was able to distribute over a month's worth of food and personal care items to families in need. https://t.co/FYSBinLcqp",replied_to,168,ObamaFoundation,1,12,32,2020-10-16T15:58:34.000Z
1317132832477712384,2293315159,"As a child in Nigeria, Michael Sunbola struggled with food insecurity, recalling days when he attended school hungry. That experience inspired him to launch @lagosfoodbank, an organization that is fighting hunger, reducing food waste, and improving child and maternal nutrition. https://t.co/1rRenhUmxw",,377,ObamaFoundation,3,18,90,2020-10-16T15:58:33.000Z
1316514186537635840,2293315159,"When #COVID19 stopped the world, it was people of color who kept it turning. That’s what Mateo Zapata hopes young people see in his images. To celebrate #LatinxHeritageMonth, we spoke to the photographer about his recent work.

Read our conversation at https://t.co/W6YmjmYZNy. https://t.co/61n7V2Z98x",,253,ObamaFoundation,4,13,84,2020-10-14T23:00:16.000Z
1316113322819936259,2293315159,"No matter where you live, you can take action to fight gun violence in our cities. 
 
Start today. Get engaged at https://t.co/IxYxDNuQaN. https://t.co/CMk9i7aXqm",,251,ObamaFoundation,5,14,74,2020-10-13T20:27:23.000Z
1316070684922126339,2293315159,"Gun violence stems from an infrastructure of inequality.

Willie Barney understood that to eliminate it, he would have to address the root causes.

Read about the success of @EmpowerOmaha—and what you can do to be part of creating peaceful communities at https://t.co/jXW2nQX1OT",,181,ObamaFoundation,1,9,65,2020-10-13T17:37:57.000Z
1315742461998903298,2293315159,"To prevent gun violence, we need to understand why and where it happens—and what we can do to stop it.  
 
Start today. Learn more at: https://t.co/QdFm0jDmZX",,233,ObamaFoundation,4,21,65,2020-10-12T19:53:42.000Z
1315713321010696193,2293315159,"On #IndigenousPeoplesDay, we spoke with Obama Fellow Joseph Kunkel. As the director of @MASSDesignLab, Joseph has spent his career designing architecture that not only honors cultural practices, but ensures self-sufficiency within Indigenous communities. https://t.co/BlSi3VFJhX",,213,ObamaFoundation,1,7,70,2020-10-12T17:57:55.000Z
1315360823708209153,2293315159,"On The International #DayoftheGirl, I’m celebrating the power and promise of young women around the world.

Two years ago, we started the @GirlsAlliance to empower adolescent girls through education. Support this work in honor of a girl in your life today: https://t.co/uAJh9LbSW0 https://t.co/ierdtRKijD",retweeted,0,ObamaFoundation,0,0,2629,2020-10-11T18:37:13.000Z
1314955749328646146,2293315159,"We spent a month capturing a glimpse of Tracey Lee’s day-to-day life as a violence interrupter, pastor, and supermom. In doing so, we witnessed this Black woman bring faith, love, and unyielding hope to her community as she worked to make our city safer. https://t.co/M7sKQBSR3B https://t.co/TgDXqQwPJV",,802,ObamaFoundation,10,28,184,2020-10-10T15:47:35.000Z
1314646887157334018,2293315159,"""Do not be silent right now."" A message from the #ObamaFellows about the continued fight for racial justice around the world. https://t.co/6M1Qa7qAHW",,337,ObamaFoundation,2,13,108,2020-10-09T19:20:17.000Z
1314584872560791552,2293315159,"To create lasting change in Chicago, @ChicagoCred works with people who are most at risk of gun violence. We had the chance to sit down with a few members of their team to hear how they’ve been able to curb gun violence by investing in these young men. https://t.co/ajbSl7vDyT",,1226,ObamaFoundation,18,62,288,2020-10-09T15:13:52.000Z
1314322470086811651,2293315159,".@arneduncan thought violence had peaked when he left Chicago to serve as Secretary of Education. He was wrong. Now, with @ChicagoCRED, he’s attempting to overcome a collective failure that has haunted him: keeping our kids safe. The results are promising. https://t.co/CqiCA6JZKn https://t.co/e9VLYuh33P",,322,ObamaFoundation,1,12,78,2020-10-08T21:51:10.000Z
1313945659624562694,2293315159,"“I wanted to help young men not make those same mistakes.” 
 
After serving a 20-year sentence and losing his own son to gun violence, Billy Moore now works as a violence interrupter, helping young men live lives of opportunity, rather than regret. https://t.co/V8PGDROLVg https://t.co/iWBt4c2bD5",,422,ObamaFoundation,2,13,126,2020-10-07T20:53:51.000Z
1313480092140662786,2293315159,"Across America, brave men and women are battling daunting odds and systemic injustices to end the gun violence that plagues our cities. They're taking action to bring about peace. Meet them. Learn from them. Commit to do your part at https://t.co/M28mnyhNKI. https://t.co/1URYI7FuX6",,474,ObamaFoundation,4,8,130,2020-10-06T14:03:51.000Z
1313155705193541634,2293315159,"For #DayoftheGirl, @MichelleObama joined @Malala and Priya Mondol from the @GirlsAlliance community for a conversation about the importance of continuing to empower and educate girls during COVID-19 and beyond. 
 
Read more from @TeenVogue:  https://t.co/Wx0BL7cjtC",,613,ObamaFoundation,5,8,140,2020-10-05T16:34:52.000Z
1312408649009106944,2293315159,Here’s to our favorite South Side love story. Happy 28th wedding anniversary @BarackObama and @MichelleObama! ❤️ https://t.co/JbR45ifDdO,,30954,ObamaFoundation,281,507,2924,2020-10-03T15:06:19.000Z
1311767177654136832,2293315159,Happy Birthday President Carter. 39 never looked so good. https://t.co/uK4Ne1RB7k,,5287,ObamaFoundation,27,47,528,2020-10-01T20:37:21.000Z
1309511689650532352,2293315159,"With COVID-19, Peace Week will move online, but will have the same focus. Ms. Saunders remains hopeful, despite online learning challenges, students will have a happy and successful school year. ""I promise, if we can all get through this year, then there’s nothing we can’t do.” https://t.co/uh39DBq3Md",replied_to,174,ObamaFoundation,3,3,41,2020-09-25T15:14:51.000Z
1309511681760993280,2293315159,"After rallying her students, they created and delivered cards for Takiya’s classmates. They spent hours with the middle schoolers and the result was the first Peace Day. Now the annual tradition has grown into a full week of honoring students who have been killed by gun violence. https://t.co/GhNdv7AM33",replied_to,161,ObamaFoundation,2,8,33,2020-09-25T15:14:49.000Z
1309511676534960128,2293315159,"In 2017, Ms. Saunders heard about Takiya Holmes, an 11-year-old who was tragically killed by a stray bullet on the South Side. She knew this was a powerful moment to teach her students an important lesson in community support, looking out for one another, and healing. https://t.co/4ImrBqxqps",replied_to,58,ObamaFoundation,0,2,14,2020-09-25T15:14:47.000Z
1309511672181207040,2293315159,"Ms. Kimberly Saunders has been a beloved @ChiPubSchools teacher for for almost 28 years. Known for her creative television production and journalism classes at Julian High School, she is always looking for teachable moments with her students, both in and out of the classroom. https://t.co/Jsm40HuD2g",,312,ObamaFoundation,11,11,79,2020-09-25T15:14:46.000Z
1308805644275908609,2293315159,"#COVID-19 made in-person learning impossible at Jaton’s learning center. But with Alfonso's help, they’ve transformed the program into an online learning platform that combats challenges of remote learning. Since the transition, they’ve helped 16,000 kids online. #ObamaLeaders https://t.co/VXtE2YWKnx",,226,ObamaFoundation,3,9,66,2020-09-23T16:29:16.000Z
1308112873617608705,2293315159,"In Vyonne’s mind, young people are the key to building sustainable peace and that’s why she won’t give up on reaching them—despite the new hurdles COVID-19 has placed in her way. On International #PeaceDay, find out how you can support @ImpartChange at https://t.co/118zuTb6VF. https://t.co/pmKyedZOYm",replied_to,95,ObamaFoundation,1,3,32,2020-09-21T18:36:27.000Z
1308112871088324608,2293315159,"After experiencing the devastating effects of violence as a child, Vyonne wanted to empower children to build more peaceful societies. At @ImpartChange, young people are taught peace-building, conflict management, and violence prevention skills. https://t.co/Xu7QFdNYoR",replied_to,128,ObamaFoundation,1,2,40,2020-09-21T18:36:26.000Z
1308112867904958464,2293315159,"Violence shatters lives.
 
That’s why Vyonne Akoth, an Obama Leader from Kenya, is nurturing the next generation of peace champions through her youth-focused nonprofit, @ImpartChange. On International #PeaceDay, get to know this Africa leader. https://t.co/in6Ryb47yw",,227,ObamaFoundation,3,11,59,2020-09-21T18:36:25.000Z
1308068002143887361,2293315159,"In light of COVID-19, they’re taking this year's race virtual. From now until September 26th, join the Race Against Gun Violence from wherever you are and 100 percent of charitable contributions will go to organizations dedicated to ending gun violence: https://t.co/gHkU4YiUQm.",replied_to,113,ObamaFoundation,2,4,37,2020-09-21T15:38:09.000Z
1308067552866820096,2293315159,"End gun violence, save lives, and build a stronger Chicago—that’s the mission behind @StridesForPeace, a non-profit that raises awareness and funds for more than 50 community organizations working towards peace in our city. https://t.co/34JJca9j9z",,270,ObamaFoundation,5,14,81,2020-09-21T15:36:21.000Z
1307334412728774656,2293315159,"""Ruth Bader Ginsburg fought to the end, through her cancer, with unwavering faith in our democracy and its ideals. That’s how we remember her. Michelle and I admired her greatly, we’re thankful for the legacy she left this country,”—@BarackObama on the passing of Justice Ginsburg https://t.co/LpNiJnFi2K",,8136,ObamaFoundation,34,69,1202,2020-09-19T15:03:07.000Z
1307062071931080710,2293315159,"To all our Jewish friends, family, and neighbors celebrating #RoshHashanah, Shanah Tovah!
 
📸: President Obama visits the Great Synagogue in Stockholm on Rosh Hashanah in 2013. https://t.co/sdHNr5wo68",,1136,ObamaFoundation,1,28,210,2020-09-18T21:00:56.000Z
1307004545713745921,2293315159,"Interrupting violence creates an opportunity for lasting peace. 
 
Get to know Chicago activist William Calloway and his work to eliminate the racial inequities at the root of gun violence at https://t.co/g2BmVpVM0W. https://t.co/L56smnDSpd",,202,ObamaFoundation,5,7,61,2020-09-18T17:12:21.000Z
1306611931898417152,2293315159,"There’s still time for elected officials to sign on to our pledge to commit to action and begin reimagining policing. Together, we can work to redefine public safety so it recognizes the humanity and dignity of every person. Mayors, take the pledge at https://t.co/7P3UaXYZg3. https://t.co/Jw4oNkqZfR",quoted,228,ObamaFoundation,1,6,90,2020-09-17T15:12:14.000Z
1306329835229319169,2293315159,Find more information and other ways to support relief efforts at https://t.co/DehfEsp308.,replied_to,146,ObamaFoundation,1,2,56,2020-09-16T20:31:17.000Z
1306329834222649346,2293315159,.@LatinoCommFdn has has re-activated its Wildfire Relief Fund to support Latino-led grassroots organizations supporting families displaced by current fires. Learn more at https://t.co/OPBSireUbJ.,replied_to,140,ObamaFoundation,4,3,64,2020-09-16T20:31:17.000Z
1306329833153204237,2293315159,".@oregonfoodbank is currently working on the front lines, providing emergency support—including water, food and other critical supplies. Support them at https://t.co/HoCJkjA1aO.",replied_to,39,ObamaFoundation,0,2,26,2020-09-16T20:31:17.000Z
1306329832045850625,2293315159,".@calfund has offered financial support to those affected by wildfires for 15 years. With their understanding of the complex nature of recoveries, they use their fund to support both mid-term to long-term efforts. Donate at https://t.co/f92kQIEbZD.",replied_to,42,ObamaFoundation,0,1,22,2020-09-16T20:31:17.000Z
1306329830603059201,2293315159,"As wildfires ravage communities in the West, people are courageously stepping up to fight the blazes and care for one another. Support them as they support their communities by donating to the organizations listed below: https://t.co/mxpRIk72Hb",,409,ObamaFoundation,6,7,124,2020-09-16T20:31:16.000Z
1306260490126061568,2293315159,"Last year, we joined thousands of our neighbors in the #MexicanIndependenceDay parade in Chicago, a celebration of Mexican pride and community spirit. While COVID-19 means we can’t march together, we can still commemorate this day together. ¡#VivaMexico! https://t.co/qVk87mUBgK",,537,ObamaFoundation,9,12,150,2020-09-16T15:55:44.000Z
1305560131652980736,2293315159,"Louise is part of the heart and soul of Jackson Park, the future home of the Obama Presidential Center. The way she cares is nothing short of extraordinary. I couldn't be more grateful for all her leadership and her help to bring the @ObamaFoundation home: https://t.co/aa0SFhb9O6",retweeted,0,ObamaFoundation,0,0,57,2020-09-14T17:32:46.000Z
1304440015699746816,2293315159,"As the co-founder of @911day, Jay is encouraging folks to commit good deeds virtually in memory of the victims of 9/11 and also the COVID-19 pandemic—from feeding first responders to supporting local restaurants. Learn more: https://t.co/zNTYjVr0CT  https://t.co/nNOZByOHFk",replied_to,1198,ObamaFoundation,4,13,245,2020-09-11T15:21:49.000Z
1304440014315696128,2293315159,"Inspired by his brother’s devotion to community service, Jay joined David Paine in 2002 in helping to build the 9/11 Day Observance initiative. They were elated when years later, President @BarackObama declared 9/11 as not only a day of remembrance, but also a day of service. https://t.co/P9oBGkGoVw",replied_to,1723,ObamaFoundation,9,15,258,2020-09-11T15:21:49.000Z
1304440012616994817,2293315159,"Jay Winuk remembers his brother Glenn as someone who always went the extra mile to help others. On Sept. 11, 2001, Glenn first helped evacuate his co-workers from their building, then ran towards the World Trade Center where he spent the final moments of his life saving others. https://t.co/xD41gZKITa",replied_to,4665,ObamaFoundation,38,126,786,2020-09-11T15:21:48.000Z
1304440011790708736,2293315159,"Eleven years ago, @BarackObama declared 9/11 as a day of remembrance through service. This is the story of how Jay Winuk’s advocacy in the wake of love and loss helped bring that declaration to life.",,1391,ObamaFoundation,7,40,284,2020-09-11T15:21:48.000Z
1304098855357681667,2293315159,"On #WorldSuicidePreventionDay, get to know @ChrisLeMark, a Chicago artist and mental health activist whose making therapy as normal as ordering a cup of coffee. https://t.co/vlAmVAWM16",,342,ObamaFoundation,7,14,120,2020-09-10T16:46:10.000Z
1303363178424918017,2293315159,"After graduating from @RoomtoRead’s education program in 2018, Kim Thùy was inspired to help local girls develop stronger literacy skills. She started a book drive in her community to give children the resources to continue their education. https://t.co/m7OsL6XoRM",replied_to,225,ObamaFoundation,2,5,45,2020-09-08T16:02:51.000Z
1303363176206143488,2293315159,"On #WorldLiteracyDay, meet Kim Thùy, a @girlsalliance leader in Vietnam. Kim grew up in a home without electricity, but despite her limited resources, she never abandoned her education, studying under an oil lamp and taking long ferry rides to get to school. https://t.co/dZJsHHru11",,314,ObamaFoundation,3,12,74,2020-09-08T16:02:51.000Z
1303017600289509400,2293315159,"“On #LaborDay, we pay tribute to the values working Americans embody – hard work, responsibility, sacrifice, and looking out for one another as one united American family.""
 
📸 President @BarackObama at Laborfest 2014 in Milwaukee, Wisconsin. https://t.co/XKxbBhqlhz",,980,ObamaFoundation,4,22,196,2020-09-07T17:09:39.000Z
1301533657262366726,2293315159,"Amid a public health crisis, Obama Fellow @tianaej and her organization @HelloCTCL are working to ensure eligible voters can participate safely—and have their vote counted. This week, they received a $250 million grant. See more about this exciting news at https://t.co/iB3oVcdBwV https://t.co/8mAuJlRKOC",,312,ObamaFoundation,4,19,97,2020-09-03T14:52:59.000Z
1301165459086217219,2293315159,"As our newest program, #ObamaLeaders: Europe will virtually connect innovative and ethical changemakers from communities across the region. Meet the cohort of leaders who will support each other as they develop tangible solutions to create a better world: https://t.co/dOh1xc8fq0 https://t.co/pvlJ6DteqA",,600,ObamaFoundation,97,83,123,2020-09-02T14:29:54.000Z
1299786220881534978,2293315159,"Only Chadwick could embody Jackie Robinson, Thurgood Marshall, and T’Challa. He, too, knew what it meant to persevere. To summon real strength. And he belongs right there with them as a hero—for Black kids and for all our kids. There’s no better gift to give our world. ❤ https://t.co/t2tjZDMxNT",retweeted,0,ObamaFoundation,0,0,50260,2020-08-29T19:09:18.000Z
1299786107824070656,2293315159,"In 2013, Chadwick Boseman visited the White House to speak to children from across the country about the pathbreaking life of Jackie Robinson. We honor Chadwick’s life and the barriers he broke while embodying Black heroes who have inspired a new generation. https://t.co/oYYH8oQGku",,4894,ObamaFoundation,8,39,679,2020-08-29T19:08:51.000Z
1299443249338298368,2293315159,"Murdered today in 1955, Chicago teen Emmett Till should have been the last wake-up call for racial justice. Sixty-five years later, may we continue working to root out racism and hatred in this country in memory of Emmett and so many other lives cut short. https://t.co/XYUsRPp1Ko",retweeted,0,ObamaFoundation,0,0,253,2020-08-28T20:26:27.000Z
1299433165900177409,2293315159,"Find ways to take action, get educated, and stay involved in the movement at https://t.co/A8z7hn0iiA.",replied_to,289,ObamaFoundation,3,14,82,2020-08-28T19:46:23.000Z
1299433013449822210,2293315159,"On the 57th Anniversary of the March on Washington, President @BarackObama shared his reflections on the current moment and what it means for the continued fight for racial justice in our country. https://t.co/ShKKq7zp03",,585,ObamaFoundation,4,21,181,2020-08-28T19:45:47.000Z
1299432644581744645,2293315159,If you’re looking to take action—or looking to educate yourselves on these issues—we’ve gathered some resources from the @ObamaFoundation that can help at https://t.co/V7b0mJoZiL.,retweeted,0,ObamaFoundation,0,0,7991,2020-08-28T19:44:19.000Z
1299000593093144576,2293315159,"As the founder of Coffee, Hip-Hop &amp; Mental Health, @ChrisLeMark is helping South Siders lead healthier lives—from normalizing therapy to increasing access to nutritional foods.
 
Check out this video Chris made about fighting hunger during a pandemic. https://t.co/Z4roTXioOu https://t.co/rVFBas2qGl",,347,ObamaFoundation,4,19,109,2020-08-27T15:07:30.000Z
1298651498398744587,2293315159,We’re thrilled to announce Columbia’s 2020-2021 cohort of @obamafoundation Scholars. As President Bollinger said: “This year we welcome 11 new scholars at a moment that starkly underscores the importance of civic leadership.” https://t.co/DgJcDWZCYz https://t.co/mr6FTzQwtk,retweeted,0,ObamaFoundation,0,0,60,2020-08-26T16:00:19.000Z
1296877351263969281,2293315159,"This #SeniorCitizensDay, get to know seven Chicagoans who have spent decades creating sustainable change in their communities, and read what advice and wisdom they have for the next wave of leaders who will carry their work forward. https://t.co/lwP3eyEtrc",,334,ObamaFoundation,6,6,103,2020-08-21T18:30:30.000Z
1296559447343595522,2293315159,"That's why Nelly launched Humanity Unites Us—an initiative that is partnering with trusted NGOs already on the ground in #Beirut. As Nelly describes, the needs of people living in the fragile aftermath of tragedy often fluctuate. Learn how you can help at: https://t.co/DW5JSlA55K",replied_to,152,ObamaFoundation,0,0,35,2020-08-20T21:27:15.000Z
1296559446206881797,2293315159,"In early August, a colossal explosion shook the Lebanese capital of #Beirut—killing hundreds and displacing and injuring tens of thousands. For Nelly Awad, an Obama Scholar who has roots in Lebanon, the news shook her to her core. https://t.co/weTEb6j58e",,251,ObamaFoundation,1,8,62,2020-08-20T21:27:15.000Z
1296142891564371969,2293315159,"Since January, they've conducted dozens of mediations over the phone, while donning PPE for street outreach. That work has helped this @MBK_Alliance National Impact Community partner reduce violence while spreading safe health practices and supporting boys and young men of color.",replied_to,140,ObamaFoundation,0,3,25,2020-08-19T17:52:01.000Z
1296142889605648388,2293315159,"For years @FComunitaria has worked to interrupt violence through mediation, helping reduce homicides in Loíza, Puerto Rico by 90 percent. But when the pandemic hit, this crucial face-to-face work had to adapt.
https://t.co/LMQJRWcvkR",,189,ObamaFoundation,5,6,41,2020-08-19T17:52:00.000Z
1295757093811695617,2293315159,"Founded by @eramshaw, a 2019 #ObamaSummit speaker, the @19thnews recently hosted a panel featuring Pulitzer Prize winner @nhannahjones and historian @marthasjones_ where they discussed some of the myths surrounding the #19thAmendment. Check out the clip and learn more. https://t.co/jWK18nN4KZ",replied_to,384,ObamaFoundation,3,9,94,2020-08-18T16:18:59.000Z
1295741039156789249,2293315159,"Despite the ratification in 1920, millions of Black, Asian, Indigenous, and Latinx women faced barriers to the ballot box. Nonprofits like the newly-formed @19thnews are focused on telling an inclusive history of the amendment and amplifying historically underrepresented voices.",replied_to,455,ObamaFoundation,2,4,103,2020-08-18T15:15:12.000Z
1295741037051289601,2293315159,"As Americans celebrate a century since the ratification of the #19thAmendment, we are reflecting on the suffrage movement’s legacy, and how women of color—despite being heavily involved in the fight for freedom—are often left out of the narrative. https://t.co/pPlY9gNruD",,1224,ObamaFoundation,10,17,442,2020-08-18T15:15:11.000Z
1295408212670373888,2293315159,"Art doesn’t let you forget.

That’s why @whcalloway helped bring Chicago’s first #BlackLivesMatter mural to his South Shore neighborhood. Learn more about his violence interruption work at https://t.co/zHQmvymM48
 
🎥: @brookssmedia https://t.co/cdeeoqxhoS",,281,ObamaFoundation,6,18,73,2020-08-17T17:12:40.000Z
1294352732984414209,2293315159,"Stories of change are beautiful. And this summer, a local photographer helped us turn them into art. 
 
See how Tyesha Moores helped us capture the beauty of what change looks like for three grassroots leaders in Chicago: 
https://t.co/FtRAbaIIe8 https://t.co/zvffF7NZg4",,204,ObamaFoundation,5,8,58,2020-08-14T19:18:34.000Z
1294290443379847171,2293315159,"As a violence interrupter, Berto knows how much it matters to have opportunities for kids in the community—and the importance of maintaining a positive presence on the street. His team does this through “positive loitering,” which he explains here: https://t.co/MusnNToOE9",replied_to,148,ObamaFoundation,3,3,36,2020-08-14T15:11:03.000Z
1294290081386299392,2293315159,"In the face of #COVID19, the effects of longterm underinvestment and discrimination in marginalized communities have intensified. So Berto and his team adapted—organizing food banks and peace marches, and fundraising for street vendors who have lost their businesses.",replied_to,162,ObamaFoundation,0,2,42,2020-08-14T15:09:36.000Z
1294289317771255808,2293315159,"To #IncreaseThePeace in neighborhoods on the West Side of Chicago, Berto Aguayo and his team at @itpchicago tackle the root causes of youth violence—a systemic lack of resources and opportunities for Black and Brown communities. In 2018, he shared his own story: https://t.co/N1cCMZoHaq",,347,ObamaFoundation,8,10,99,2020-08-14T15:06:34.000Z
1293927237872476160,2293315159,"Happy #LeftHandersDay!

""Dream big, work hard!""—@BarackObama https://t.co/C0aZCfx9z2",,6379,ObamaFoundation,288,149,1078,2020-08-13T15:07:48.000Z
1292938177611694080,2293315159,We’re proud to invest in violence interrupters because data shows they play an outsized role in keeping our kids and communities safe. This story from Stockton covers what that work looks like—and how it’s changed in light of COVID-19 and ongoing protests. https://t.co/dERkSkLTXG,retweeted,0,ObamaFoundation,0,0,47,2020-08-10T21:37:37.000Z
1292900606403846151,2293315159,"Our Chief Engagement Officer and lifelong Chicagoan @StrautMike joined @ChiPubLib to read a story about understanding mindfulness to kids across the city. 
 
Check out this #LiveFromTheLibrary reading of Here and Now: https://t.co/K9ekM4KQhE",,274,ObamaFoundation,2,8,73,2020-08-10T19:08:20.000Z
