tweet_id,author_id,text,tweet_type,like_count,company_name,quote_count,reply_count,retweet_count,created_at
1185272260225044482,2293315159,"A Chicago based non-profit with a mission to turn awareness into action, Bright Pink is saving lives from breast and ovarian cancer by empowering women to be proactive when it comes to healthcare. 
 
This Breast Cancer Awareness Month, meet the women behind @BeBrightPink. #BCAM https://t.co/VtCO0TWaIE",,292,ObamaFoundation,3,5,81,2019-10-18T19:11:42.000Z
1184952320762810368,2293315159,"“A family compound is a place where childcare is your grandmother and everyone on the street is related to you.” Growing up at her family's compound in Puerto Rico, Alana Feldman Soler found her purpose to advocate for boys and young men of color in her community. #ObamaSummit https://t.co/jkb3mhkio7",,324,ObamaFoundation,1,7,62,2019-10-17T22:00:23.000Z
1184851156209750019,2293315159,We’re searching for additional artifacts that tell the story of @BarackObama and @MichelleObama for possible inclusion in the Obama Presidential Center Museum. Have something you’d like us to consider? Tell us about it here: https://t.co/5AHpo319ej,replied_to,130,ObamaFoundation,3,10,47,2019-10-17T15:18:23.000Z
1184850928689668097,2293315159,"For Pier Smith of the Bronzeville neighborhood on Chicago’s South Side, this #ObamaKeepsake is more than a fashion statement—it’s a reminder of the Obama’s impact on popular culture. “You cannot look at them and not see how much style and elegance they brought.” https://t.co/u8bTwk4sLg",,155,ObamaFoundation,0,9,45,2019-10-17T15:17:29.000Z
1184574433081675778,2293315159,The #ObamaSummit is quickly approaching—and we want to hear about the place that revealed your purpose. Submit your response today at https://t.co/aGSLPSV4Fe for a chance to be featured on our channels!,replied_to,213,ObamaFoundation,1,12,50,2019-10-16T20:58:47.000Z
1184574342627254274,2293315159,"“My purpose in life emerged through long reflective evenings and days...to seek peace and bring peace to others.” Ahead of the #ObamaSummit, you’ve shared the places that made you who you are. For Kyril, it was his family's hogan on the land of the Navajo Nation. https://t.co/d1HKbtnwqA",,380,ObamaFoundation,0,15,72,2019-10-16T20:58:26.000Z
1184091569005256704,2293315159,"This December, @BarackObama and @MichelleObama will join our first-ever #ObamaLeaders: Asia-Pacific gathering in Malaysia. The initiative will connect 200 changemakers from across the region for a year-long leadership program: https://t.co/cg38Am7Jqn https://t.co/XfT4aH9OjC",,672,ObamaFoundation,5,27,147,2019-10-15T13:00:04.000Z
1183789203827679247,2293315159,"On Indigenous Peoples’ Day, see how one of our #ObamaFellows is increasing literacy rates and helping indigenous youth in Colombia leverage their cultural heritage as a source of learning and an economic driver through @FundaElorigen.
https://t.co/46PzzngZ9G https://t.co/SQgicMZ9n2",,505,ObamaFoundation,3,14,158,2019-10-14T16:58:34.000Z
1182752643942436870,2293315159,"On the #DayoftheGirl, learn about how this grassroots organization helps girls in rural Vietnam get to school safely. https://t.co/RQXM2YcfPD",quoted,399,ObamaFoundation,5,12,113,2019-10-11T20:19:39.000Z
1182675441125150721,2293315159,"Happy #DayoftheGirl! I’m excited to share that in December, I’ll be visiting Vietnam to meet some of the inspiring girls from the @GirlsAlliance community and the organizations that work so hard to support their dreams. 
 
I can't wait to share their stories with you.",retweeted,0,ObamaFoundation,0,0,3207,2019-10-11T15:12:52.000Z
1182412783389949952,2293315159,"@JacobBulBior Ahead of the #ObamaSummit, tell us about the place that made you: https://t.co/mA9MSHmi7o.",replied_to,167,ObamaFoundation,7,12,49,2019-10-10T21:49:10.000Z
1182412695552905216,2293315159,"Places can reveal our purpose. For one of our #ObamaScholars @jacobbulbior, that place is the Kakuma refugee camp in Kenya. Raised there amidst harrowing circumstances, he found strength in community. It led him to a career of cultivating peace in South Sudan. https://t.co/fWmDyK0nHw",,337,ObamaFoundation,3,9,78,2019-10-10T21:48:49.000Z
1182319106143465472,2293315159,@BarackObama We’re continuing our search for unique items that tell the story of @BarackObama’s career for possible inclusion in the Obama Presidential Center Museum. Have something you’d like us to consider? Tell us about it here: https://t.co/5AHpo319ej,replied_to,201,ObamaFoundation,0,9,53,2019-10-10T15:36:55.000Z
1182319034693509121,2293315159,"Krystal Grover-Webb spent over 150 hours creating her #ObamaKeepsake as reminder of @BarackObama's commitment to the next generation of leaders: ""And that’s building a better world and leaving a better foundation for generations to come.” https://t.co/gVH5jZY60V",,394,ObamaFoundation,3,12,81,2019-10-10T15:36:38.000Z
1182008266244677633,2293315159,"An #ObamaKeepsake is a reminder of the inspiring path we took to get to where we are. Today, we’re headed to Iowa to connect with community members about the items that tell the story of the important role Iowa played in the historic 2008 presidential campaign and beyond. https://t.co/XRIazepyHK",,310,ObamaFoundation,1,11,64,2019-10-09T19:01:45.000Z
1181330490646810625,2293315159,"Don’t miss your chance to join us at the #ObamaSummit! We’re giving away tickets to two lucky people and their plus ones to join us in Chicago with @BarackObama and @MichelleObama.

Enter to win here: https://t.co/SCGltGcfjQ
And find contest rules here: https://t.co/bnEdMsZC4p https://t.co/z7vIptJKX6",,646,ObamaFoundation,19,59,161,2019-10-07T22:08:31.000Z
1180216666770329602,2293315159,Exciting news! We've extended the application deadline for our Spring Internship. Learn more and apply by October 13th to join us in our Chicago or D.C. offices: https://t.co/SwVWOGARKd https://t.co/640cAvCOre,,236,ObamaFoundation,4,18,81,2019-10-04T20:22:35.000Z
1179884317658566658,2293315159,✌️7 years. https://t.co/AGtkphUcCc,,5249,ObamaFoundation,21,57,336,2019-10-03T22:21:57.000Z
1179775767556874241,2293315159,We’re searching for other unique items that tell the story of @BarackObama’s career for possible inclusion in the Obama Presidential Center Museum. Share this link with someone you know who has an #ObamaKeepsake: https://t.co/5AHpo319ej,replied_to,212,ObamaFoundation,3,14,69,2019-10-03T15:10:36.000Z
1179775600933904384,2293315159,"When Ghian Foreman looks at his #ObamaKeepsake, he thinks of the last time he carried his daughter on his shoulders, “I had to have her see this momentous occasion.” He hopes these items—and the stories that go with them—convey how much the Obama family meant to him. https://t.co/OQV0liIC4d",,364,ObamaFoundation,6,17,87,2019-10-03T15:09:57.000Z
1179501977903992832,2293315159,"This year’s #ObamaSummit is focused on how places reveal our purpose. Through PlaceBase Productions, Ashley Hanson helps people in small towns reconnect with each other and the pride they have in places they call home. Which place shaped you? Tell us at https://t.co/mA9MSHmi7o https://t.co/OumKznVGOg",,291,ObamaFoundation,4,8,68,2019-10-02T21:02:40.000Z
1178760640334323714,2293315159,"Rosh Hashanah represents a chance to reflect on the past and look forward to another year of making the world we live in a kinder, more peaceful place. Shanah Tovah to all those celebrating today. https://t.co/fItu1QHVBn",,949,ObamaFoundation,4,16,181,2019-09-30T19:56:51.000Z
1177686715076677638,2293315159,"A sweet take on workforce development, this Chicago business is helping returning citizens learn new skills and build the confidence they need to re-enter the workforce. 
 
See how Sweet Beginnings's honey-infused @beelovebuzz products are putting people back on their feet: https://t.co/HVyJtYUI2W",,491,ObamaFoundation,11,15,95,2019-09-27T20:49:27.000Z
1177311441969471488,2293315159,"When @BarackObama was elected, Wylene Patterson went out and bought five copies of the newspaper for her kids. She held on to this special edition of @Essence, her #ObamaKeepsake, for the same reason. “I didn’t want a computer copy. I wanted the originals to give to them.” https://t.co/hdwOdGf1Zm",,666,ObamaFoundation,7,25,88,2019-09-26T19:58:15.000Z
1177245472827858944,2293315159,The date is set! @BarackObama and @MichelleObama will join us this October in Chicago for an #ObamaSummit focused on the power of place. Join us as we prepare for the event—show us the place that shaped who you are and share how it gives you purpose here: https://t.co/7VdNzQqky8 https://t.co/n1VbCidm0Z,,733,ObamaFoundation,4,20,170,2019-09-26T15:36:07.000Z
1176879412052135937,2293315159,"Yesterday in Cape Town, several of our #ObamaLeaders met with The Duke and Duchess of Sussex at a reception celebrating young people who are building a brighter future for the continent. https://t.co/LMxxq2p2vq",,2883,ObamaFoundation,26,35,380,2019-09-25T15:21:31.000Z
1176578672595275777,2293315159,"“You can opt out of the act of voting, but you can’t opt out of the outcome.”
 
On #NationalVoterRegistrationDay, meet Tiana Epps-Johnson and her team at @HelloCTCL. By making voting more accessible, they’re boosting voter turnout in the U.S. https://t.co/btXdJ9H04I",,428,ObamaFoundation,8,13,139,2019-09-24T19:26:29.000Z
1175064479228485632,2293315159,"From the @BudParade to Chicago Pride and numerous festivals in between, we spent our summer celebrating the diversity and spirit of our hometown. Take a look at the highlights from a Chicago summer spent alongside our neighbors: https://t.co/QjDggB9Nr9",,464,ObamaFoundation,2,22,97,2019-09-20T15:09:38.000Z
1174710145894551552,2293315159,We’re on the lookout for unique items for potential acquisition and possible display in the Obama Presidential Center Museum. Have an #ObamaKeepsake for us to consider? Share your information here: https://t.co/5AHpo319ej,replied_to,182,ObamaFoundation,3,7,64,2019-09-19T15:41:38.000Z
1174710140475518976,2293315159,"“It’s the history of how we got here.” Mike added buttons, signs, and stickers to his jacket over the course of @BarackObama’s career. https://t.co/P89M1eAHmq",replied_to,210,ObamaFoundation,0,6,39,2019-09-19T15:41:37.000Z
1174710132866985985,2293315159,"At our community collections event in Chicago this summer, we asked Chicagoans to share an #ObamaKeepsake with us. And Mike Smith of Woodlawn walked in wearing his. https://t.co/WqAtdfmgrT",,261,ObamaFoundation,1,9,56,2019-09-19T15:41:35.000Z
1174434354346561537,2293315159,"“We are doctors for the healthcare system.” 

As one of our 2019 #ObamaFellows and CEO of Shamseya, @sabaeayman is increasing access to healthcare across Egypt, and putting people at the center of solutions. https://t.co/Gz5ozSURwD",,289,ObamaFoundation,2,12,80,2019-09-18T21:25:44.000Z
1174054301372731392,2293315159,"Our future will be shaped by the next generation—and @GretaThunberg isn't waiting to get started. At 16, Greta is a leading voice in the fight to save our planet. Yesterday, she sat down with @BarackObama for a conversation about how no one is too young to change the world. https://t.co/7qnIXyUY8P",,28547,ObamaFoundation,734,494,6841,2019-09-17T20:15:32.000Z
1173675874085982215,2293315159,"209 years ago, Father Miguel Hidalgo y Costilla called on his community to join together and rise up against inequality. Today, we celebrate that relentless pursuit of independence. To all of the communities celebrating across the world, Happy #MexicanIndependenceDay! https://t.co/N7RK71deIs",,713,ObamaFoundation,6,15,142,2019-09-16T19:11:48.000Z
1172234257852485632,2293315159,We’re on the lookout for unique items for potential acquisition and possible display in the Obama Presidential Center Museum. Have an #ObamaKeepsake for us to consider? Share your information here: https://t.co/5AHpo319ej,replied_to,211,ObamaFoundation,2,7,68,2019-09-12T19:43:20.000Z
1172234254304055297,2293315159,"“Everything they did and worked on was so important to our country and to the world...is an important part of our history.” When Diane Nelson teaches her students about the former first family, she shares this #ObamaKeepsake: White House Easter Eggs. https://t.co/HreiSZPbHA",,333,ObamaFoundation,4,6,67,2019-09-12T19:43:19.000Z
1171905709493161985,2293315159,Applications for the 2020-2021 @ObamaFoundation Scholars Program at Columbia are now open! Learn more &amp; apply: https://t.co/o02uRClt5H https://t.co/yhk8pfsdIU,retweeted,0,ObamaFoundation,0,0,87,2019-09-11T21:57:48.000Z
1171904233567936512,2293315159,"9/11 changed the trajectory of Sasha Fisher’s life, as it did for so many others. Her response to tragedy was to do whatever she could to create a better world. Today as we remember those we lost, we honor their lives through service. https://t.co/UBKrgxVHM3",,355,ObamaFoundation,3,5,80,2019-09-11T21:51:56.000Z
1171504807988715520,2293315159,"“The mind is so powerful that it can be going through its own challenges, but still tell you nothing is wrong.” On #WorldSuicidePreventionDay, meet Hauwa Ojeifo of @SheWritesWoman, which helps Nigerian women struggling with mental health challenges feel less alone. #ObamaLeaders https://t.co/AvJgdmuGcn",,561,ObamaFoundation,3,10,144,2019-09-10T19:24:46.000Z
1169738573626712065,2293315159,We’re looking for artifacts that relate to @BarackObama’s career for potential acquisition and possible display at the Obama Presidential Center Museum. Do you have an item you’d like to share for consideration? Tell us about your #ObamaKeepsake: https://t.co/5AHpo319ej,replied_to,347,ObamaFoundation,217,1250,123,2019-09-05T22:26:23.000Z
1169738571164651521,2293315159,"“It shows the evolution of @BarackObama from a community organizer to a Senator to President.” Lazerick Vaughen hung onto four of these yard signs for years, keeping them in his home attic in the Chatham neighborhood on Chicago’s South Side. https://t.co/5296HEcyvI",,1076,ObamaFoundation,27,76,162,2019-09-05T22:26:22.000Z
1169639985982640128,2293315159,"As students here in the U.S. head back to school, let's remember that more than 98 million adolescent girls around the world don’t have that opportunity.

This #WorldCharityDay, share your #BackToSchool photo and take action with the @girlsalliance: https://t.co/uAJh9LbSW0 https://t.co/p5mFJ2p1fo",retweeted,0,ObamaFoundation,0,0,1962,2019-09-05T15:54:38.000Z
1167465543995154432,2293315159,"Chicago is a city of broad shoulders and grassroots change—the one where @BarackObama got his start. Before they immerse themselves in an academic program that will help them expand their global impact, we brought the new #ObamaScholars to our hometown to share its story. https://t.co/chUnvZ7PPw",,433,ObamaFoundation,10,16,100,2019-08-30T15:54:10.000Z
1167192299425718272,2293315159,Have an #ObamaKeepsake that might help us preserve the Obamas' legacy for generations to come? Submit your artifact here: https://t.co/5AHpo319ej,replied_to,176,ObamaFoundation,2,8,36,2019-08-29T21:48:24.000Z
1167192296426803210,2293315159,"These Obama nesting dolls are a small part of Kathryn Annerino’s #ObamaKeepsake collection. Sent to her as gifts, Kathryn finds hope in these items. “It made me extremely proud that my country elected somebody with such character...it still just really, really stays with me.” https://t.co/RdivYbZbuX",,677,ObamaFoundation,4,12,106,2019-08-29T21:48:23.000Z
1166043174722310145,2293315159,"Leaders require mentorship.
 
As a success coach to our #CommunityLeadership Corps, Rupa Ramadurai is providing feedback and support to young leaders throughout their six-month journey to create change in Chicago. Read more about her experience: https://t.co/Vk2c0RGQOL https://t.co/ZwxhhKL8Fp",,387,ObamaFoundation,6,8,89,2019-08-26T17:42:11.000Z
1164988319840788486,2293315159,"Representation matters—every child should see themselves in the careers they want to pursue. 
 
Through mentoring and clinical experiences, @IAMABEL_FND is showing minority students in Chicago the careers in medicine that are possible. https://t.co/BtTEvuoeHD",,467,ObamaFoundation,8,13,144,2019-08-23T19:50:34.000Z
1164609058487377920,2293315159,"Over the next few months, we’ll be featuring an #ObamaKeepsake every Thursday—memorabilia that connect us to special moments in @BarackObama and @MichelleObama’s story and that will help us preserve their legacy for generations to come. Submit yours here: https://t.co/5AHpo2JxPJ",replied_to,257,ObamaFoundation,3,12,59,2019-08-22T18:43:31.000Z
1164609055614210048,2293315159,"What’s your #ObamaKeepsake? For Marieth Mitchell of Chicago, it’s this t-shirt from a street vendor in Grant Park the night @BarackObama was elected. It connects her to the spirit of that historical night. “I just want to have that memory, that history.” https://t.co/KHrlvnwyAn",,581,ObamaFoundation,8,32,116,2019-08-22T18:43:30.000Z
1164249809055866880,2293315159,"When we bridge the gap between generations, we learn life’s most important lessons. 

On #SeniorCitizensDay, meet Alex Smith and his team @TheCaresFamily, who are connecting young professionals and their older neighbors to reduce loneliness in cities across the U.K. https://t.co/JLaH4nNfyS",,489,ObamaFoundation,18,20,131,2019-08-21T18:55:59.000Z
1163933718727331840,2293315159,"Where you are born shouldn’t hold you back from getting a quality education. That’s the belief at the core of @IndusAction, an organization developed by one of our 2019 #ObamaFellows that has helped thousands of families understand and leverage their right to education in India. https://t.co/xkdr1idvyY",,497,ObamaFoundation,18,17,139,2019-08-20T21:59:58.000Z
1161739791844696065,2293315159,Some of America’s most inspiring stories are nestled in the communities of rural towns. One of our #ObamaFellows is using community theatre to bring these stories to life—and shift the narrative about what it means to live and work outside of big cities. https://t.co/ttLEVfn8Zj,,474,ObamaFoundation,7,16,132,2019-08-14T20:42:05.000Z
1161391627350339584,2293315159,South Side southpaw. Happy #LeftHandersDay! https://t.co/kp0RGvI5wY,,3264,ObamaFoundation,52,82,464,2019-08-13T21:38:36.000Z
1160939796803543041,2293315159,Happy #InternationalYouthDay! Join us to celebrate by taking action for adolescent girls’ education around the world. Here are six ways to start: https://t.co/eXvqaaNSog,retweeted,0,ObamaFoundation,0,0,65,2019-08-12T15:43:11.000Z
1158858761248878592,2293315159,"“What can I do where I am?” 
 
As we remember Toni Morrison, we think of how her words changed lives. See how Morrison inspired our neighbor, Candice Washington, to create an initiative that educates children on black culture through art, literature, and cultural programming. https://t.co/bHGfv1pA9C",,1660,ObamaFoundation,25,36,329,2019-08-06T21:53:53.000Z
1158761819063955456,2293315159,"#ObamaLeaders: Asia-Pacific is a year-long leadership development and civic engagement program that will inspire, empower, and connect emerging leaders from across the region. 
 
Apply now at https://t.co/cg38Am7Jqn https://t.co/pjSZGT2MI3",,462,ObamaFoundation,16,13,118,2019-08-06T15:28:41.000Z
1157383391223980035,2293315159,"In honor of President @BarackObama’s birthday, we’re hosting a 44-Hour fundraiser! 
 
Make his birthday the most special one yet by helping us preserve his legacy for years to come: https://t.co/bdzmlgpMPV https://t.co/2Dl5gBcM5w",,1737,ObamaFoundation,30,75,419,2019-08-02T20:11:18.000Z
1156659448783548417,2293315159,"“It’s always my hope to show the beauty and richness of Africa, one design at a time.” 
 
Meet @tshumaosmond, the Zimbabwean artist behind the logo and spatial designs for #ObamaLeaders: Africa: https://t.co/lmKyG20S4A https://t.co/UFVLhCqtA8",,755,ObamaFoundation,26,17,230,2019-07-31T20:14:36.000Z
1156280659348008961,2293315159,"Could a school garden help grow the next generation of conservationists? 
 
One of our 2019 #ObamaFellows started @greenourplanet2 to find out. See how Ciara Byrne’s organization is teaching ecology, math, and business in an unexpected way: gardening. https://t.co/v7YSjzkeI0",,415,ObamaFoundation,22,17,125,2019-07-30T19:09:26.000Z
1155964789157351431,2293315159,"Inauguration tickets. Old newspapers. Obama family nesting dolls. What’s your #ObamaKeepsake?

This weekend, Chicagoans shared items that will help us tell the story of @BarackObama’s legacy for generations to come. Tell us about your Obama memorabilia: https://t.co/5AHpo2JxPJ https://t.co/dj2DXxLEux",,465,ObamaFoundation,9,43,98,2019-07-29T22:14:17.000Z
1155137272326631424,2293315159,"2,922 paintings. That’s how many portraits Rob Pruitt created of President @BarackObama—one for every day of his two terms. 
 
Read how Pruitt’s project immortalized this historic presidency—and will continue to tell the story for generations to come: https://t.co/Op6cW3bGvj https://t.co/wsFPvL4FEp",,576,ObamaFoundation,15,18,159,2019-07-27T15:26:01.000Z
1154489694341804032,2293315159,"Leaders: Africa may have ended, but 200 inspiring #ObamaLeaders returned to their homes with the new connections and fresh perspectives that will help them change the future. https://t.co/7CTavugKd7 https://t.co/Bm7VgpjTRO",,8667,ObamaFoundation,125,704,1347,2019-07-25T20:32:47.000Z
1154105451434389504,2293315159,"Imagination. Passion. Values. Courage. Resilience.
According to @FredSwaniker, these are five traits every leader should have—and what we saw in the 200 #ObamaLeaders from across Africa. See more from their week-long event: https://t.co/7CTavugKd7 https://t.co/Xc6VUBav6s",,371,ObamaFoundation,12,8,113,2019-07-24T19:05:56.000Z
1151890840660402179,2293315159,"Leading through service is what #MandelaDay is all about. 

Last week in Johannesburg, #ObamaLeaders helped touch up a local school and shared why stepping up in their community is such a vital part of leadership: https://t.co/QMZZe18q7D",,606,ObamaFoundation,17,21,181,2019-07-18T16:25:52.000Z
1151622008104529920,2293315159,"You saw yesterday’s @BarackObama surprise, but what did our interns think? 

Hear the Obama Youth Job Corps interns reflect on a Tuesday they’ll never forget. https://t.co/aXguqB8rfN",,2272,ObamaFoundation,88,72,492,2019-07-17T22:37:37.000Z
1151277902186582017,2293315159,"They may have just graduated high school, but these @UrbanAlliance interns have dedicated their summers to working hard—and @BarackObama dropped by to share some encouragement. https://t.co/1PwcnTrSOT",quoted,2345,ObamaFoundation,47,42,414,2019-07-16T23:50:16.000Z
1150879352848097281,2293315159,"They’re ready to take their civic leadership to the next level. They’re ready to change the world. 
 
Congratulations to the 200 #ObamaLeaders returning to their homes across Africa after a week of leadership development, connection, and empowerment. https://t.co/7CTavugKd7 https://t.co/dWluenR5b7",,693,ObamaFoundation,11,25,144,2019-07-15T21:26:34.000Z
1149718785290637314,2293315159,.@MichelleObama’s inspiring message to #ObamaLeaders: Africa—a convening of leaders from across the continent who are building Africa’s future today: https://t.co/7CTavugKd7 https://t.co/m8DnLAbDWE,,826,ObamaFoundation,17,36,188,2019-07-12T16:34:53.000Z
1149337213802557443,2293315159,"Today, I met @wenceslasdjokpe at the #ObamaLeaders Convening in Johannesburg. We discovered that we share a passion for girls' education and adolescent empowerment. We both hope for a future where girls are able to lead themselves and others; and achieve their dreams @BarackObama https://t.co/mZgRdWe00t",retweeted,0,ObamaFoundation,0,0,48,2019-07-11T15:18:40.000Z
1149219473792077824,2293315159,"Today at 1:30pm SAST, we’re going live from #ObamaLeaders: Africa as Trevor Manuel and @TheRealNozi take the mainstage to talk about what it takes to lead effectively.
 
Don’t miss it. Tune in at https://t.co/7CTavugKd7.",,238,ObamaFoundation,5,11,68,2019-07-11T07:30:48.000Z
1149009477825388544,2293315159,"The @ObamaFoundation is helping a new generation of leaders make their mark, and there’s an extraordinary group gathering this week for Obama Leaders: Africa. Their work will help unlock the incredible promise of the continent—and make the world better for all of us. https://t.co/rnPHn9UuEn",retweeted,0,ObamaFoundation,0,0,7331,2019-07-10T17:36:21.000Z
1148980087557107712,2293315159,"The @ObamaFoundation Leaders: Africa program will allow me and other #ObamaLeaders to focus on the areas of innovation, diversity, creativity and connection while bringing the change that Africa has been waiting for. https://t.co/7QJCg0cR17",retweeted,0,ObamaFoundation,0,0,44,2019-07-10T15:39:34.000Z
1148970058951090177,2293315159,"For these #ObamaLeaders, it’s just beginning. Today kicks off Obama Leaders: Africa in Johannesburg. 

Learn more about the leaders, and tune into our live streams at https://t.co/7CTavugKd7. https://t.co/ZtJaeUalTK",quoted,250,ObamaFoundation,7,6,82,2019-07-10T14:59:43.000Z
1146794826819604481,2293315159,An Independence Day favorite from our archives. Happy Fourth of July! https://t.co/OVotIqA2CA,,1776,ObamaFoundation,18,43,281,2019-07-04T14:56:07.000Z
1146455123759194113,2293315159,"Together, we can create the world we want to see. 

Read more from our CEO, @d_simas, in our 2018 Annual Report: 
https://t.co/sLY4LG3qNx https://t.co/RxaoE23nZ8",,360,ObamaFoundation,2,13,85,2019-07-03T16:26:16.000Z
1145743177590157312,2293315159,Proud to call Chicago our home. https://t.co/K4G6zwmZ8m,,1232,ObamaFoundation,11,38,151,2019-07-01T17:17:15.000Z
